tcpdump -n -i eth0

r 407884659], length 0
21:11:40.022298 IP 138.197.143.231.22 > 198.96.85.106.49776: Flags [P.], seq 282136:282500, ack 3133, win 483, options [nop,nop,TS val 407884763 ecr 2550164960], length 364
21:11:40.028510 IP 198.96.85.106.49776 > 138.197.143.231.22: Flags [.], ack 282500, win 13064, options [nop,nop,TS val 2550165063 ecr 407884763], length 0
21:11:40.126361 IP 138.197.143.231.22 > 198.96.85.106.49776: Flags [P.], seq 282500:282712, ack 3133, win 483, options [nop,nop,TS val 407884867 ecr 2550165063], length 212
21:11:40.126440 IP 138.197.143.231.22 > 198.96.85.106.49776: Flags [P.], seq 282712:282908, ack 3133, win 483, options [nop,nop,TS val 407884867 ecr 2550165063], length 196
21:11:40.132581 IP 198.96.85.106.49776 > 138.197.143.231.22: Flags [.], ack 282908, win 13064, options [nop,nop,TS val 2550165167 ecr 407884867], length 0
21:11:40.230308 IP 138.197.143.231.22 > 198.96.85.106.49776: Flags [P.], seq 282908:283448, ack 3133, win 483, options [nop,nop,TS val 407884971 ecr 2550165167], length 540
21:11:40.236507 IP 198.96.85.106.49776 > 138.197.143.231.22: Flags [.], ack 283448, win 13064, options [nop,nop,TS val 2550165271 ecr 407884971], length 0
21:11:40.334277 IP 138.197.143.231.22 > 198.96.85.106.49776: Flags [P.], seq 283448:283660, ack 3133, win 483, options [nop,nop,TS val 407885075 ecr 2550165271], length 212
21:11:40.334367 IP 138.197.143.231.22 > 198.96.85.106.49776: Flags [P.], seq 283660:283856, ack 3133, win 483, options [nop,nop,TS val 407885075 ecr 2550165271], length 196
21:11:40.340347 IP 198.96.85.106.49776 > 138.197.143.231.22: Flags [.], ack 283856, win 13064, options [nop,nop,TS val 2550165375 ecr 407885075], length 0
21:11:40.438300 IP 138.197.143.231.22 > 198.96.85.106.49776: Flags [P.], seq 283856:284396, ack 3133, win 483, options [nop,nop,TS val 407885179 ecr 2550165375], length 540
21:11:40.444563 IP 198.96.85.106.49776 > 138.197.143.231.22: Flags [.], ack 284396, win 13064, options [nop,nop,TS val 2550165479 ecr 407885179], length 0
21:11:40.542318 IP 138.197.143.231.22 > 198.96.85.106.49776: Flags [P.], seq 284396:284608, ack 3133, win 483, options [nop,nop,TS val 407885283 ecr 2550165479], length 212
21:11:40.542413 IP 138.197.143.231.22 > 198.96.85.106.49776: Flags [P.], seq 284608:284804, ack 3133, win 483, options [nop,nop,TS val 407885283 ecr 2550165479], length 196
21:11:40.548727 IP 198.96.85.106.49776 > 138.197.143.231.22: Flags [.], ack 284804, win 13064, options [nop,nop,TS val 2550165584 ecr 407885283], length 0
21:11:40.646295 IP 138.197.143.231.22 > 198.96.85.106.49776: Flags [P.], seq 284804:285344, ack 3133, win 483, options [nop,nop,TS val 407885387 ecr 2550165584], length 540
21:11:40.652409 IP 198.96.85.106.49776 > 138.197.143.231.22: Flags [.], ack 285344, win 13064, options [nop,nop,TS val 2550165687 ecr 407885387], length 0
21:11:40.750358 IP 138.197.143.231.22 > 198.96.85.106.49776: Flags [P.], seq 285344:285556, ack 3133, win 483, options [nop,nop,TS val 407885491 ecr 2550165687], length 212
21:11:40.750470 IP 138.197.143.231.22 > 198.96.85.106.49776: Flags [P.], seq 285556:285752, ack 3133, win 483, options [nop,nop,TS val 407885491 ecr 2550165687], length 196
21:11:40.756719 IP 198.96.85.106.49776 > 138.197.143.231.22: Flags [.], ack 285752, win 13064, options [nop,nop,TS val 2550165792 ecr 407885491], length 0
21:11:40.854295 IP 138.197.143.231.22 > 198.96.85.106.49776: Flags [P.], seq 285752:286292, ack 3133, win 483, options [nop,nop,TS val 407885595 ecr 2550165792], length 540
21:11:40.881791 IP 198.96.85.106.49776 > 138.197.143.231.22: Flags [.], ack 286292, win 13064, options [nop,nop,TS val 2550165909 ecr 407885595], length 0
21:11:40.958238 IP 138.197.143.231.22 > 198.96.85.106.49776: Flags [P.], seq 286292:286504, ack 3133, win 483, options [nop,nop,TS val 407885699 ecr 2550165909], length 212
21:11:40.958357 IP 138.197.143.231.22 > 198.96.85.106.49776: Flags [P.], seq 286504:286700, ack 3133, win 483, options [nop,nop,TS val 407885699 ecr 2550165909], length 196
21:11:40.963803 IP 198.96.85.106.49776 > 138.197.143.231.22: Flags [.], ack 286700, win 13064, options [nop,nop,TS val 2550165999 ecr 407885699], length 0
21:11:41.062338 IP 138.197.143.231.22 > 198.96.85.106.49776: Flags [P.], seq 286700:287240, ack 3133, win 483, options [nop,nop,TS val 407885803 ecr 2550165999], length 540
21:11:41.068266 IP 198.96.85.106.49776 > 138.197.143.231.22: Flags [.], ack 287240, win 13064, options [nop,nop,TS val 2550166103 ecr 407885803], length 0
21:11:41.166325 IP 138.197.143.231.22 > 198.96.85.106.49776: Flags [P.], seq 287240:287452, ack 3133, win 483, options [nop,nop,TS val 407885907 ecr 2550166103], length 212
21:11:41.166446 IP 138.197.143.231.22 > 198.96.85.106.49776: Flags [P.], seq 287452:287648, ack 3133, win 483, options [nop,nop,TS val 407885907 ecr 2550166103], length 196
21:11:41.173014 IP 198.96.85.106.49776 > 138.197.143.231.22: Flags [.], ack 287648, win 13064, options [nop,nop,TS val 2550166208 ecr 407885907], length 0
21:11:41.270318 IP 138.197.143.231.22 > 198.96.85.106.49776: Flags [P.], seq 287648:288188, ack 3133, win 483, options [nop,nop,TS val 407886011 ecr 2550166208], length 540
21:11:41.279324 IP 198.96.85.106.49776 > 138.197.143.231.22: Flags [.], ack 288188, win 13064, options [nop,nop,TS val 2550166312 ecr 407886011], length 0
21:11:41.374339 IP 138.197.143.231.22 > 198.96.85.106.49776: Flags [P.], seq 288188:288400, ack 3133, win 483, options [nop,nop,TS val 407886115 ecr 2550166312], length 212
21:11:41.374517 IP 138.197.143.231.22 > 198.96.85.106.49776: Flags [P.], seq 288400:288596, ack 3133, win 483, options [nop,nop,TS val 407886115 ecr 2550166312], length 196
21:11:41.382578 IP 198.96.85.106.49776 > 138.197.143.231.22: Flags [.], ack 288596, win 13064, options [nop,nop,TS val 2550166416 ecr 407886115], length 0
21:11:41.478348 IP 138.197.143.231.22 > 198.96.85.106.49776: Flags [P.], seq 288596:289136, ack 3133, win 483, options [nop,nop,TS val 407886219 ecr 2550166416], length 540
21:11:41.486648 IP 198.96.85.106.49776 > 138.197.143.231.22: Flags [.], ack 289136, win 13064, options [nop,nop,TS val 2550166522 ecr 407886219], length 0
21:11:41.582284 IP 138.197.143.231.22 > 198.96.85.106.49776: Flags [P.], seq 289136:289348, ack 3133, win 483, options [nop,nop,TS val 407886323 ecr 2550166522], length 212
21:11:41.582427 IP 138.197.143.231.22 > 198.96.85.106.49776: Flags [P.], seq 289348:289544, ack 3133, win 483, options [nop,nop,TS val 407886323 ecr 2550166522], length 196
21:11:41.588739 IP 198.96.85.106.49776 > 138.197.143.231.22: Flags [.], ack 289544, win 13064, options [nop,nop,TS val 2550166624 ecr 407886323], length 0
21:11:41.686266 IP 138.197.143.231.22 > 198.96.85.106.49776: Flags [P.], seq 289544:290084, ack 3133, win 483, options [nop,nop,TS val 407886427 ecr 2550166624], length 540
21:11:41.692372 IP 198.96.85.106.49776 > 138.197.143.231.22: Flags [.], ack 290084, win 13064, options [nop,nop,TS val 2550166727 ecr 407886427], length 0
21:11:41.790281 IP 138.197.143.231.22 > 198.96.85.106.49776: Flags [P.], seq 290084:290296, ack 3133, win 483, options [nop,nop,TS val 407886531 ecr 2550166727], length 212
21:11:41.790363 IP 138.197.143.231.22 > 198.96.85.106.49776: Flags [P.], seq 290296:290492, ack 3133, win 483, options [nop,nop,TS val 407886531 ecr 2550166727], length 196
21:11:41.796045 IP 198.96.85.106.49776 > 138.197.143.231.22: Flags [.], ack 290492, win 13064, options [nop,nop,TS val 2550166831 ecr 407886531], length 0
21:11:41.894328 IP 138.197.143.231.22 > 198.96.85.106.49776: Flags [P.], seq 290492:291032, ack 3133, win 483, options [nop,nop,TS val 407886635 ecr 2550166831], length 540
21:11:41.900849 IP 198.96.85.106.49776 > 138.197.143.231.22: Flags [.], ack 291032, win 13064, options [nop,nop,TS val 2550166936 ecr 407886635], length 0
21:11:41.998295 IP 138.197.143.231.22 > 198.96.85.106.49776: Flags [P.], seq 291032:291244, ack 3133, win 483, options [nop,nop,TS val 407886739 ecr 2550166936], length 212
21:11:41.998387 IP 138.197.143.231.22 > 198.96.85.106.49776: Flags [P.], seq 291244:291440, ack 3133, win 483, options [nop,nop,TS val 407886739 ecr 2550166936], length 196
21:11:42.004437 IP 198.96.85.106.49776 > 138.197.143.231.22: Flags [.], ack 291440, win 13064, options [nop,nop,TS val 2550167039 ecr 407886739], length 0
21:11:42.102269 IP 138.197.143.231.22 > 198.96.85.106.49776: Flags [P.], seq 291440:291980, ack 3133, win 483, options [nop,nop,TS val 407886843 ecr 2550167039], length 540
21:11:42.108652 IP 198.96.85.106.49776 > 138.197.143.231.22: Flags [.], ack 291980, win 13064, options [nop,nop,TS val 2550167144 ecr 407886843], length 0
21:11:42.206274 IP 138.197.143.231.22 > 198.96.85.106.49776: Flags [P.], seq 291980:292192, ack 3133, win 483, options [nop,nop,TS val 407886947 ecr 2550167144], length 212
21:11:42.206377 IP 138.197.143.231.22 > 198.96.85.106.49776: Flags [P.], seq 292192:292388, ack 3133, win 483, options [nop,nop,TS val 407886947 ecr 2550167144], length 196
21:11:42.212471 IP 198.96.85.106.49776 > 138.197.143.231.22: Flags [.], ack 292388, win 13064, options [nop,nop,TS val 2550167247 ecr 407886947], length 0
21:11:42.310300 IP 138.197.143.231.22 > 198.96.85.106.49776: Flags [P.], seq 292388:292928, ack 3133, win 483, options [nop,nop,TS val 407887051 ecr 2550167247], length 540
21:11:42.315434 IP 198.96.85.106.49776 > 138.197.143.231.22: Flags [.], ack 292928, win 13064, options [nop,nop,TS val 2550167350 ecr 407887051], length 0
21:11:42.414301 IP 138.197.143.231.22 > 198.96.85.106.49776: Flags [P.], seq 292928:293140, ack 3133, win 483, options [nop,nop,TS val 407887155 ecr 2550167350], length 212
21:11:42.414391 IP 138.197.143.231.22 > 198.96.85.106.49776: Flags [P.], seq 293140:293336, ack 3133, win 483, options [nop,nop,TS val 407887155 ecr 2550167350], length 196
21:11:42.420390 IP 198.96.85.106.49776 > 138.197.143.231.22: Flags [.], ack 293336, win 13064, options [nop,nop,TS val 2550167455 ecr 407887155], length 0
21:11:42.421862 IP 198.96.85.106.49776 > 138.197.143.231.22: Flags [P.], seq 3133:3169, ack 293336, win 13064, options [nop,nop,TS val 2550167455 ecr 407887155], length 36
21:11:42.421907 IP 138.197.143.231.22 > 198.96.85.106.49776: Flags [.], ack 3169, win 483, options [nop,nop,TS val 407887162 ecr 2550167455], length 0
21:11:42.518371 IP 138.197.143.231.22 > 198.96.85.106.49776: Flags [P.], seq 293336:294204, ack 3169, win 483, options [nop,nop,TS val 407887259 ecr 2550167455], length 868
21:11:42.525059 IP 198.96.85.106.49776 > 138.197.143.231.22: Flags [.], ack 294204, win 13064, options [nop,nop,TS val 2550167560 ecr 407887259], length 0
21:11:42.622265 IP 138.197.143.231.22 > 198.96.85.106.49776: Flags [P.], seq 294204:294416, ack 3169, win 483, options [nop,nop,TS val 407887363 ecr 2550167560], length 212
21:11:42.622350 IP 138.197.143.231.22 > 198.96.85.106.49776: Flags [P.], seq 294416:294612, ack 3169, win 483, options [nop,nop,TS val 407887363 ecr 2550167560], length 196
21:11:42.628556 IP 198.96.85.106.49776 > 138.197.143.231.22: Flags [.], ack 294612, win 13064, options [nop,nop,TS val 2550167663 ecr 407887363], length 0
21:11:42.726310 IP 138.197.143.231.22 > 198.96.85.106.49776: Flags [P.], seq 294612:295152, ack 3169, win 483, options [nop,nop,TS val 407887467 ecr 2550167663], length 540
21:11:42.732733 IP 198.96.85.106.49776 > 138.197.143.231.22: Flags [.], ack 295152, win 13064, options [nop,nop,TS val 2550167768 ecr 407887467], length 0
21:11:42.830241 IP 138.197.143.231.22 > 198.96.85.106.49776: Flags [P.], seq 295152:295364, ack 3169, win 483, options [nop,nop,TS val 407887571 ecr 2550167768], length 212
21:11:42.830319 IP 138.197.143.231.22 > 198.96.85.106.49776: Flags [P.], seq 295364:295560, ack 3169, win 483, options [nop,nop,TS val 407887571 ecr 2550167768], length 196
21:11:42.836570 IP 198.96.85.106.49776 > 138.197.143.231.22: Flags [.], ack 295560, win 13064, options [nop,nop,TS val 2550167871 ecr 407887571], length 0
21:11:42.934270 IP 138.197.143.231.22 > 198.96.85.106.49776: Flags [P.], seq 295560:296100, ack 3169, win 483, options [nop,nop,TS val 407887675 ecr 2550167871], length 540
21:11:42.940635 IP 198.96.85.106.49776 > 138.197.143.231.22: Flags [.], ack 296100, win 13064, options [nop,nop,TS val 2550167976 ecr 407887675], length 0
21:11:43.038299 IP 138.197.143.231.22 > 198.96.85.106.49776: Flags [P.], seq 296100:296312, ack 3169, win 483, options [nop,nop,TS val 407887779 ecr 2550167976], length 212
21:11:43.038410 IP 138.197.143.231.22 > 198.96.85.106.49776: Flags [P.], seq 296312:296508, ack 3169, win 483, options [nop,nop,TS val 407887779 ecr 2550167976], length 196
21:11:43.044568 IP 198.96.85.106.49776 > 138.197.143.231.22: Flags [.], ack 296508, win 13064, options [nop,nop,TS val 2550168079 ecr 407887779], length 0
21:11:43.142336 IP 138.197.143.231.22 > 198.96.85.106.49776: Flags [P.], seq 296508:297048, ack 3169, win 483, options [nop,nop,TS val 407887883 ecr 2550168079], length 540
21:11:43.148777 IP 198.96.85.106.49776 > 138.197.143.231.22: Flags [.], ack 297048, win 13064, options [nop,nop,TS val 2550168184 ecr 407887883], length 0
21:11:43.246335 IP 138.197.143.231.22 > 198.96.85.106.49776: Flags [P.], seq 297048:297260, ack 3169, win 483, options [nop,nop,TS val 407887987 ecr 2550168184], length 212
21:11:43.246495 IP 138.197.143.231.22 > 198.96.85.106.49776: Flags [P.], seq 297260:297456, ack 3169, win 483, options [nop,nop,TS val 407887987 ecr 2550168184], length 196
21:11:43.252468 IP 198.96.85.106.49776 > 138.197.143.231.22: Flags [.], ack 297456, win 13064, options [nop,nop,TS val 2550168287 ecr 407887987], length 0
21:11:43.350302 IP 138.197.143.231.22 > 198.96.85.106.49776: Flags [P.], seq 297456:297996, ack 3169, win 483, options [nop,nop,TS val 407888091 ecr 2550168287], length 540
21:11:43.356798 IP 198.96.85.106.49776 > 138.197.143.231.22: Flags [.], ack 297996, win 13064, options [nop,nop,TS val 2550168392 ecr 407888091], length 0
21:11:43.454280 IP 138.197.143.231.22 > 198.96.85.106.49776: Flags [P.], seq 297996:298208, ack 3169, win 483, options [nop,nop,TS val 407888195 ecr 2550168392], length 212
21:11:43.454531 IP 138.197.143.231.22 > 198.96.85.106.49776: Flags [P.], seq 298208:298404, ack 3169, win 483, options [nop,nop,TS val 407888195 ecr 2550168392], length 196
21:11:43.461083 IP 198.96.85.106.49776 > 138.197.143.231.22: Flags [.], ack 298404, win 13064, options [nop,nop,TS val 2550168496 ecr 407888195], length 0
21:11:43.558310 IP 138.197.143.231.22 > 198.96.85.106.49776: Flags [P.], seq 298404:298944, ack 3169, win 483, options [nop,nop,TS val 407888299 ecr 2550168496], length 540
21:11:43.565227 IP 198.96.85.106.49776 > 138.197.143.231.22: Flags [.], ack 298944, win 13064, options [nop,nop,TS val 2550168600 ecr 407888299], length 0
21:11:43.662325 IP 138.197.143.231.22 > 198.96.85.106.49776: Flags [P.], seq 298944:299156, ack 3169, win 483, options [nop,nop,TS val 407888403 ecr 2550168600], length 212
21:11:43.662418 IP 138.197.143.231.22 > 198.96.85.106.49776: Flags [P.], seq 299156:299352, ack 3169, win 483, options [nop,nop,TS val 407888403 ecr 2550168600], length 196
21:11:43.668391 IP 198.96.85.106.49776 > 138.197.143.231.22: Flags [.], ack 299352, win 13064, options [nop,nop,TS val 2550168703 ecr 407888403], length 0
21:11:43.766300 IP 138.197.143.231.22 > 198.96.85.106.49776: Flags [P.], seq 299352:299892, ack 3169, win 483, options [nop,nop,TS val 407888507 ecr 2550168703], length 540
21:11:43.772817 IP 198.96.85.106.49776 > 138.197.143.231.22: Flags [.], ack 299892, win 13064, options [nop,nop,TS val 2550168808 ecr 407888507], length 0
21:11:43.870323 IP 138.197.143.231.22 > 198.96.85.106.49776: Flags [P.], seq 299892:300256, ack 3169, win 483, options [nop,nop,TS val 407888611 ecr 2550168808], length 364
21:11:43.876457 IP 198.96.85.106.49776 > 138.197.143.231.22: Flags [.], ack 300256, win 13064, options [nop,nop,TS val 2550168911 ecr 407888611], length 0
21:11:43.974296 IP 138.197.143.231.22 > 198.96.85.106.49776: Flags [P.], seq 300256:300620, ack 3169, win 483, options [nop,nop,TS val 407888715 ecr 2550168911], length 364
21:11:43.987779 IP 198.96.85.106.49776 > 138.197.143.231.22: Flags [.], ack 300620, win 13064, options [nop,nop,TS val 2550169023 ecr 407888715], length 0
21:11:44.078293 IP 138.197.143.231.22 > 198.96.85.106.49776: Flags [P.], seq 300620:300832, ack 3169, win 483, options [nop,nop,TS val 407888819 ecr 2550169023], length 212
21:11:44.078380 IP 138.197.143.231.22 > 198.96.85.106.49776: Flags [P.], seq 300832:301028, ack 3169, win 483, options [nop,nop,TS val 407888819 ecr 2550169023], length 196
21:11:44.083600 IP 198.96.85.106.49776 > 138.197.143.231.22: Flags [.], ack 301028, win 13064, options [nop,nop,TS val 2550169119 ecr 407888819], length 0
21:11:44.182269 IP 138.197.143.231.22 > 198.96.85.106.49776: Flags [P.], seq 301028:301568, ack 3169, win 483, options [nop,nop,TS val 407888923 ecr 2550169119], length 540
21:11:44.188323 IP 198.96.85.106.49776 > 138.197.143.231.22: Flags [.], ack 301568, win 13064, options [nop,nop,TS val 2550169223 ecr 407888923], length 0
21:11:44.286263 IP 138.197.143.231.22 > 198.96.85.106.49776: Flags [P.], seq 301568:301780, ack 3169, win 483, options [nop,nop,TS val 407889027 ecr 2550169223], length 212
21:11:44.286348 IP 138.197.143.231.22 > 198.96.85.106.49776: Flags [P.], seq 301780:301976, ack 3169, win 483, options [nop,nop,TS val 407889027 ecr 2550169223], length 196
21:11:44.292557 IP 198.96.85.106.49776 > 138.197.143.231.22: Flags [.], ack 301976, win 13064, options [nop,nop,TS val 2550169327 ecr 407889027], length 0
21:11:44.390304 IP 138.197.143.231.22 > 198.96.85.106.49776: Flags [P.], seq 301976:302516, ack 3169, win 483, options [nop,nop,TS val 407889131 ecr 2550169327], length 540
21:11:44.396838 IP 198.96.85.106.49776 > 138.197.143.231.22: Flags [.], ack 302516, win 13064, options [nop,nop,TS val 2550169432 ecr 407889131], length 0
21:11:44.494301 IP 138.197.143.231.22 > 198.96.85.106.49776: Flags [P.], seq 302516:302728, ack 3169, win 483, options [nop,nop,TS val 407889235 ecr 2550169432], length 212
21:11:44.494387 IP 138.197.143.231.22 > 198.96.85.106.49776: Flags [P.], seq 302728:302924, ack 3169, win 483, options [nop,nop,TS val 407889235 ecr 2550169432], length 196
21:11:44.500497 IP 198.96.85.106.49776 > 138.197.143.231.22: Flags [.], ack 302924, win 13064, options [nop,nop,TS val 2550169535 ecr 407889235], length 0
21:11:44.598279 IP 138.197.143.231.22 > 198.96.85.106.49776: Flags [P.], seq 302924:303464, ack 3169, win 483, options [nop,nop,TS val 407889339 ecr 2550169535], length 540
21:11:44.604868 IP 198.96.85.106.49776 > 138.197.143.231.22: Flags [.], ack 303464, win 13064, options [nop,nop,TS val 2550169639 ecr 407889339], length 0
21:11:44.702308 IP 138.197.143.231.22 > 198.96.85.106.49776: Flags [P.], seq 303464:303828, ack 3169, win 483, options [nop,nop,TS val 407889443 ecr 2550169639], length 364
21:11:44.708934 IP 198.96.85.106.49776 > 138.197.143.231.22: Flags [.], ack 303828, win 13064, options [nop,nop,TS val 2550169743 ecr 407889443], length 0
21:11:44.806325 IP 138.197.143.231.22 > 198.96.85.106.49776: Flags [P.], seq 303828:304192, ack 3169, win 483, options [nop,nop,TS val 407889547 ecr 2550169743], length 364
21:11:44.812611 IP 198.96.85.106.49776 > 138.197.143.231.22: Flags [.], ack 304192, win 13064, options [nop,nop,TS val 2550169848 ecr 407889547], length 0
21:11:44.910361 IP 138.197.143.231.22 > 198.96.85.106.49776: Flags [P.], seq 304192:304556, ack 3169, win 483, options [nop,nop,TS val 407889651 ecr 2550169848], length 364
21:11:44.917690 IP 198.96.85.106.49776 > 138.197.143.231.22: Flags [.], ack 304556, win 13064, options [nop,nop,TS val 2550169952 ecr 407889651], length 0
21:11:45.014310 IP 138.197.143.231.22 > 198.96.85.106.49776: Flags [P.], seq 304556:304920, ack 3169, win 483, options [nop,nop,TS val 407889755 ecr 2550169952], length 364
21:11:45.020347 IP 198.96.85.106.49776 > 138.197.143.231.22: Flags [.], ack 304920, win 13064, options [nop,nop,TS val 2550170055 ecr 407889755], length 0
21:11:45.118302 IP 138.197.143.231.22 > 198.96.85.106.49776: Flags [P.], seq 304920:305284, ack 3169, win 483, options [nop,nop,TS val 407889859 ecr 2550170055], length 364
21:11:45.123769 IP 198.96.85.106.49776 > 138.197.143.231.22: Flags [.], ack 305284, win 13064, options [nop,nop,TS val 2550170159 ecr 407889859], length 0
21:11:45.222314 IP 138.197.143.231.22 > 198.96.85.106.49776: Flags [P.], seq 305284:305496, ack 3169, win 483, options [nop,nop,TS val 407889963 ecr 2550170159], length 212
21:11:45.222405 IP 138.197.143.231.22 > 198.96.85.106.49776: Flags [P.], seq 305496:305692, ack 3169, win 483, options [nop,nop,TS val 407889963 ecr 2550170159], length 196
21:11:45.228443 IP 198.96.85.106.49776 > 138.197.143.231.22: Flags [.], ack 305692, win 13064, options [nop,nop,TS val 2550170263 ecr 407889963], length 0
21:11:45.326291 IP 138.197.143.231.22 > 198.96.85.106.49776: Flags [P.], seq 305692:305904, ack 3169, win 483, options [nop,nop,TS val 407890067 ecr 2550170263], length 212
21:11:45.326403 IP 138.197.143.231.22 > 198.96.85.106.49776: Flags [P.], seq 305904:306268, ack 3169, win 483, options [nop,nop,TS val 407890067 ecr 2550170263], length 364
21:11:45.331405 IP 198.96.85.106.49776 > 138.197.143.231.22: Flags [.], ack 306268, win 13064, options [nop,nop,TS val 2550170366 ecr 407890067], length 0
21:11:45.430376 IP 138.197.143.231.22 > 198.96.85.106.49776: Flags [P.], seq 306268:306808, ack 3169, win 483, options [nop,nop,TS val 407890171 ecr 2550170366], length 540
21:11:45.436675 IP 198.96.85.106.49776 > 138.197.143.231.22: Flags [.], ack 306808, win 13064, options [nop,nop,TS val 2550170472 ecr 407890171], length 0
21:11:45.534287 IP 138.197.143.231.22 > 198.96.85.106.49776: Flags [P.], seq 306808:307020, ack 3169, win 483, options [nop,nop,TS val 407890275 ecr 2550170472], length 212
21:11:45.534391 IP 138.197.143.231.22 > 198.96.85.106.49776: Flags [P.], seq 307020:307216, ack 3169, win 483, options [nop,nop,TS val 407890275 ecr 2550170472], length 196
21:11:45.540981 IP 198.96.85.106.49776 > 138.197.143.231.22: Flags [.], ack 307216, win 13064, options [nop,nop,TS val 2550170576 ecr 407890275], length 0
21:11:45.638337 IP 138.197.143.231.22 > 198.96.85.106.49776: Flags [P.], seq 307216:307756, ack 3169, win 483, options [nop,nop,TS val 407890379 ecr 2550170576], length 540
21:11:45.644946 IP 198.96.85.106.49776 > 138.197.143.231.22: Flags [.], ack 307756, win 13064, options [nop,nop,TS val 2550170679 ecr 407890379], length 0
21:11:45.742377 IP 138.197.143.231.22 > 198.96.85.106.49776: Flags [P.], seq 307756:307968, ack 3169, win 483, options [nop,nop,TS val 407890483 ecr 2550170679], length 212
21:11:45.742503 IP 138.197.143.231.22 > 198.96.85.106.49776: Flags [P.], seq 307968:308164, ack 3169, win 483, options [nop,nop,TS val 407890483 ecr 2550170679], length 196
21:11:45.748859 IP 198.96.85.106.49776 > 138.197.143.231.22: Flags [.], ack 308164, win 13064, options [nop,nop,TS val 2550170784 ecr 407890483], length 0
21:11:45.846467 IP 138.197.143.231.22 > 198.96.85.106.49776: Flags [P.], seq 308164:308704, ack 3169, win 483, options [nop,nop,TS val 407890587 ecr 2550170784], length 540
21:11:45.852715 IP 198.96.85.106.49776 > 138.197.143.231.22: Flags [.], ack 308704, win 13064, options [nop,nop,TS val 2550170888 ecr 407890587], length 0
21:11:45.950331 IP 138.197.143.231.22 > 198.96.85.106.49776: Flags [P.], seq 308704:308916, ack 3169, win 483, options [nop,nop,TS val 407890691 ecr 2550170888], length 212
21:11:45.950455 IP 138.197.143.231.22 > 198.96.85.106.49776: Flags [P.], seq 308916:309112, ack 3169, win 483, options [nop,nop,TS val 407890691 ecr 2550170888], length 196
21:11:45.956482 IP 198.96.85.106.49776 > 138.197.143.231.22: Flags [.], ack 309112, win 13064, options [nop,nop,TS val 2550170991 ecr 407890691], length 0
21:11:46.054350 IP 138.197.143.231.22 > 198.96.85.106.49776: Flags [P.], seq 309112:309652, ack 3169, win 483, options [nop,nop,TS val 407890795 ecr 2550170991], length 540
21:11:46.060700 IP 198.96.85.106.49776 > 138.197.143.231.22: Flags [.], ack 309652, win 13064, options [nop,nop,TS val 2550171096 ecr 407890795], length 0
21:11:46.158304 IP 138.197.143.231.22 > 198.96.85.106.49776: Flags [P.], seq 309652:309864, ack 3169, win 483, options [nop,nop,TS val 407890899 ecr 2550171096], length 212
21:11:46.158388 IP 138.197.143.231.22 > 198.96.85.106.49776: Flags [P.], seq 309864:310060, ack 3169, win 483, options [nop,nop,TS val 407890899 ecr 2550171096], length 196
21:11:46.164410 IP 198.96.85.106.49776 > 138.197.143.231.22: Flags [.], ack 310060, win 13064, options [nop,nop,TS val 2550171199 ecr 407890899], length 0
21:11:46.262266 IP 138.197.143.231.22 > 198.96.85.106.49776: Flags [P.], seq 310060:310272, ack 3169, win 483, options [nop,nop,TS val 407891003 ecr 2550171199], length 212
21:11:46.262361 IP 138.197.143.231.22 > 198.96.85.106.49776: Flags [P.], seq 310272:310636, ack 3169, win 483, options [nop,nop,TS val 407891003 ecr 2550171199], length 364
21:11:46.268480 IP 198.96.85.106.49776 > 138.197.143.231.22: Flags [.], ack 310636, win 13064, options [nop,nop,TS val 2550171303 ecr 407891003], length 0
21:11:46.366359 IP 138.197.143.231.22 > 198.96.85.106.49776: Flags [P.], seq 310636:310848, ack 3169, win 483, options [nop,nop,TS val 407891107 ecr 2550171303], length 212
21:11:46.366526 IP 138.197.143.231.22 > 198.96.85.106.49776: Flags [P.], seq 310848:311212, ack 3169, win 483, options [nop,nop,TS val 407891107 ecr 2550171303], length 364
21:11:46.372590 IP 198.96.85.106.49776 > 138.197.143.231.22: Flags [.], ack 311212, win 13064, options [nop,nop,TS val 2550171407 ecr 407891107], length 0
21:11:46.470340 IP 138.197.143.231.22 > 198.96.85.106.49776: Flags [P.], seq 311212:311752, ack 3169, win 483, options [nop,nop,TS val 407891211 ecr 2550171407], length 540
21:11:46.476577 IP 198.96.85.106.49776 > 138.197.143.231.22: Flags [.], ack 311752, win 13064, options [nop,nop,TS val 2550171511 ecr 407891211], length 0
21:11:46.574263 IP 138.197.143.231.22 > 198.96.85.106.49776: Flags [P.], seq 311752:311964, ack 3169, win 483, options [nop,nop,TS val 407891315 ecr 2550171511], length 212
21:11:46.574362 IP 138.197.143.231.22 > 198.96.85.106.49776: Flags [P.], seq 311964:312160, ack 3169, win 483, options [nop,nop,TS val 407891315 ecr 2550171511], length 196
21:11:46.580593 IP 198.96.85.106.49776 > 138.197.143.231.22: Flags [.], ack 312160, win 13064, options [nop,nop,TS val 2550171615 ecr 407891315], length 0
21:11:46.678290 IP 138.197.143.231.22 > 198.96.85.106.49776: Flags [P.], seq 312160:312700, ack 3169, win 483, options [nop,nop,TS val 407891419 ecr 2550171615], length 540
21:11:46.684334 IP 198.96.85.106.49776 > 138.197.143.231.22: Flags [.], ack 312700, win 13064, options [nop,nop,TS val 2550171719 ecr 407891419], length 0
21:11:46.782270 IP 138.197.143.231.22 > 198.96.85.106.49776: Flags [P.], seq 312700:312912, ack 3169, win 483, options [nop,nop,TS val 407891523 ecr 2550171719], length 212
21:11:46.782350 IP 138.197.143.231.22 > 198.96.85.106.49776: Flags [P.], seq 312912:313108, ack 3169, win 483, options [nop,nop,TS val 407891523 ecr 2550171719], length 196
21:11:46.788438 IP 198.96.85.106.49776 > 138.197.143.231.22: Flags [.], ack 313108, win 13064, options [nop,nop,TS val 2550171823 ecr 407891523], length 0
21:11:46.886276 IP 138.197.143.231.22 > 198.96.85.106.49776: Flags [P.], seq 313108:313648, ack 3169, win 483, options [nop,nop,TS val 407891627 ecr 2550171823], length 540
21:11:46.893316 IP 198.96.85.106.49776 > 138.197.143.231.22: Flags [.], ack 313648, win 13064, options [nop,nop,TS val 2550171928 ecr 407891627], length 0
21:11:46.990258 IP 138.197.143.231.22 > 198.96.85.106.49776: Flags [P.], seq 313648:314012, ack 3169, win 483, options [nop,nop,TS val 407891731 ecr 2550171928], length 364
21:11:46.996646 IP 198.96.85.106.49776 > 138.197.143.231.22: Flags [.], ack 314012, win 13064, options [nop,nop,TS val 2550172031 ecr 407891731], length 0
21:11:47.094289 IP 138.197.143.231.22 > 198.96.85.106.49776: Flags [P.], seq 314012:314376, ack 3169, win 483, options [nop,nop,TS val 407891835 ecr 2550172031], length 364
21:11:47.100834 IP 198.96.85.106.49776 > 138.197.143.231.22: Flags [.], ack 314376, win 13064, options [nop,nop,TS val 2550172136 ecr 407891835], length 0
21:11:47.198314 IP 138.197.143.231.22 > 198.96.85.106.49776: Flags [P.], seq 314376:314740, ack 3169, win 483, options [nop,nop,TS val 407891939 ecr 2550172136], length 364
21:11:47.204560 IP 198.96.85.106.49776 > 138.197.143.231.22: Flags [.], ack 314740, win 13064, options [nop,nop,TS val 2550172239 ecr 407891939], length 0
21:11:47.302273 IP 138.197.143.231.22 > 198.96.85.106.49776: Flags [P.], seq 314740:315104, ack 3169, win 483, options [nop,nop,TS val 407892043 ecr 2550172239], length 364
21:11:47.308614 IP 198.96.85.106.49776 > 138.197.143.231.22: Flags [.], ack 315104, win 13064, options [nop,nop,TS val 2550172343 ecr 407892043], length 0
21:11:47.406266 IP 138.197.143.231.22 > 198.96.85.106.49776: Flags [P.], seq 315104:315468, ack 3169, win 483, options [nop,nop,TS val 407892147 ecr 2550172343], length 364
21:11:47.412547 IP 198.96.85.106.49776 > 138.197.143.231.22: Flags [.], ack 315468, win 13064, options [nop,nop,TS val 2550172447 ecr 407892147], length 0
21:11:47.478818 IP 193.163.125.66.48230 > 138.197.143.231.1755: Flags [S], seq 2668522813, win 14600, options [mss 1460], length 0
21:11:47.510395 IP 138.197.143.231.22 > 198.96.85.106.49776: Flags [P.], seq 315468:315968, ack 3169, win 483, options [nop,nop,TS val 407892251 ecr 2550172447], length 500
21:11:47.516791 IP 198.96.85.106.49776 > 138.197.143.231.22: Flags [.], ack 315968, win 13064, options [nop,nop,TS val 2550172552 ecr 407892251], length 0
21:11:47.614279 IP 138.197.143.231.22 > 198.96.85.106.49776: Flags [P.], seq 315968:316180, ack 3169, win 483, options [nop,nop,TS val 407892355 ecr 2550172552], length 212
21:11:47.614369 IP 138.197.143.231.22 > 198.96.85.106.49776: Flags [P.], seq 316180:316376, ack 3169, win 483, options [nop,nop,TS val 407892355 ecr 2550172552], length 196
21:11:47.620320 IP 198.96.85.106.49776 > 138.197.143.231.22: Flags [.], ack 316376, win 13064, options [nop,nop,TS val 2550172655 ecr 407892355], length 0
21:11:47.718340 IP 138.197.143.231.22 > 198.96.85.106.49776: Flags [P.], seq 316376:316916, ack 3169, win 483, options [nop,nop,TS val 407892459 ecr 2550172655], length 540
21:11:47.724966 IP 198.96.85.106.49776 > 138.197.143.231.22: Flags [.], ack 316916, win 13064, options [nop,nop,TS val 2550172760 ecr 407892459], length 0
21:11:47.822235 IP 138.197.143.231.22 > 198.96.85.106.49776: Flags [P.], seq 316916:317128, ack 3169, win 483, options [nop,nop,TS val 407892563 ecr 2550172760], length 212
21:11:47.822333 IP 138.197.143.231.22 > 198.96.85.106.49776: Flags [P.], seq 317128:317324, ack 3169, win 483, options [nop,nop,TS val 407892563 ecr 2550172760], length 196
21:11:47.826630 IP 198.96.85.106.49776 > 138.197.143.231.22: Flags [.], ack 317128, win 13064, options [nop,nop,TS val 2550172862 ecr 407892563], length 0
21:11:47.828068 IP 198.96.85.106.49776 > 138.197.143.231.22: Flags [.], ack 317324, win 13064, options [nop,nop,TS val 2550172862 ecr 407892563], length 0
21:11:47.926265 IP 138.197.143.231.22 > 198.96.85.106.49776: Flags [P.], seq 317324:318024, ack 3169, win 483, options [nop,nop,TS val 407892667 ecr 2550172862], length 700
21:11:47.932197 IP 198.96.85.106.49776 > 138.197.143.231.22: Flags [.], ack 318024, win 13064, options [nop,nop,TS val 2550172967 ecr 407892667], length 0
21:11:48.030329 IP 138.197.143.231.22 > 198.96.85.106.49776: Flags [P.], seq 318024:318236, ack 3169, win 483, options [nop,nop,TS val 407892771 ecr 2550172967], length 212
21:11:48.030447 IP 138.197.143.231.22 > 198.96.85.106.49776: Flags [P.], seq 318236:318432, ack 3169, win 483, options [nop,nop,TS val 407892771 ecr 2550172967], length 196
21:11:48.035041 IP 198.96.85.106.49776 > 138.197.143.231.22: Flags [.], ack 318432, win 13064, options [nop,nop,TS val 2550173071 ecr 407892771], length 0
21:11:48.134312 IP 138.197.143.231.22 > 198.96.85.106.49776: Flags [P.], seq 318432:318972, ack 3169, win 483, options [nop,nop,TS val 407892875 ecr 2550173071], length 540
21:11:48.142586 IP 198.96.85.106.49776 > 138.197.143.231.22: Flags [.], ack 318972, win 13064, options [nop,nop,TS val 2550173177 ecr 407892875], length 0
21:11:48.238280 IP 138.197.143.231.22 > 198.96.85.106.49776: Flags [P.], seq 318972:319184, ack 3169, win 483, options [nop,nop,TS val 407892979 ecr 2550173177], length 212
21:11:48.238354 IP 138.197.143.231.22 > 198.96.85.106.49776: Flags [P.], seq 319184:319380, ack 3169, win 483, options [nop,nop,TS val 407892979 ecr 2550173177], length 196
21:11:48.246853 IP 198.96.85.106.49776 > 138.197.143.231.22: Flags [.], ack 319380, win 13064, options [nop,nop,TS val 2550173282 ecr 407892979], length 0
21:11:48.342325 IP 138.197.143.231.22 > 198.96.85.106.49776: Flags [P.], seq 319380:319920, ack 3169, win 483, options [nop,nop,TS val 407893083 ecr 2550173282], length 540
21:11:48.353328 IP 198.96.85.106.49776 > 138.197.143.231.22: Flags [.], ack 319920, win 13064, options [nop,nop,TS val 2550173388 ecr 407893083], length 0
21:11:48.446289 IP 138.197.143.231.22 > 198.96.85.106.49776: Flags [P.], seq 319920:320132, ack 3169, win 483, options [nop,nop,TS val 407893187 ecr 2550173388], length 212
21:11:48.446381 IP 138.197.143.231.22 > 198.96.85.106.49776: Flags [P.], seq 320132:320328, ack 3169, win 483, options [nop,nop,TS val 407893187 ecr 2550173388], length 196
21:11:48.464096 IP 138.197.143.231.22 > 198.96.85.106.49776: Flags [P.], seq 320132:320328, ack 3169, win 483, options [nop,nop,TS val 407893205 ecr 2550173388], length 196
21:11:48.464454 IP 198.96.85.106.49776 > 138.197.143.231.22: Flags [.], ack 320328, win 13064, options [nop,nop,TS val 2550173492 ecr 407893187], length 0
21:11:48.484523 IP 198.96.85.106.49776 > 138.197.143.231.22: Flags [.], ack 320328, win 13064, options [nop,nop,TS val 2550173510 ecr 407893205,nop,nop,sack 1 {320132:320328}], length 0
21:11:48.550360 IP 138.197.143.231.22 > 198.96.85.106.49776: Flags [P.], seq 320328:321228, ack 3169, win 483, options [nop,nop,TS val 407893291 ecr 2550173510], length 900
21:11:48.556665 IP 198.96.85.106.49776 > 138.197.143.231.22: Flags [.], ack 321228, win 13064, options [nop,nop,TS val 2550173591 ecr 407893291], length 0
21:11:48.654254 IP 138.197.143.231.22 > 198.96.85.106.49776: Flags [P.], seq 321228:321440, ack 3169, win 483, options [nop,nop,TS val 407893395 ecr 2550173591], length 212
21:11:48.654342 IP 138.197.143.231.22 > 198.96.85.106.49776: Flags [P.], seq 321440:321636, ack 3169, win 483, options [nop,nop,TS val 407893395 ecr 2550173591], length 196
21:11:48.660597 IP 198.96.85.106.49776 > 138.197.143.231.22: Flags [.], ack 321636, win 13064, options [nop,nop,TS val 2550173695 ecr 407893395], length 0
21:11:48.758299 IP 138.197.143.231.22 > 198.96.85.106.49776: Flags [P.], seq 321636:322176, ack 3169, win 483, options [nop,nop,TS val 407893499 ecr 2550173695], length 540
21:11:48.764680 IP 198.96.85.106.49776 > 138.197.143.231.22: Flags [.], ack 322176, win 13064, options [nop,nop,TS val 2550173799 ecr 407893499], length 0
21:11:48.862325 IP 138.197.143.231.22 > 198.96.85.106.49776: Flags [P.], seq 322176:322540, ack 3169, win 483, options [nop,nop,TS val 407893603 ecr 2550173799], length 364
21:11:48.868678 IP 198.96.85.106.49776 > 138.197.143.231.22: Flags [.], ack 322540, win 13064, options [nop,nop,TS val 2550173904 ecr 407893603], length 0
21:11:48.966326 IP 138.197.143.231.22 > 198.96.85.106.49776: Flags [P.], seq 322540:322904, ack 3169, win 483, options [nop,nop,TS val 407893707 ecr 2550173904], length 364
21:11:48.972723 IP 198.96.85.106.49776 > 138.197.143.231.22: Flags [.], ack 322904, win 13064, options [nop,nop,TS val 2550174008 ecr 407893707], length 0
21:11:49.070289 IP 138.197.143.231.22 > 198.96.85.106.49776: Flags [P.], seq 322904:323268, ack 3169, win 483, options [nop,nop,TS val 407893811 ecr 2550174008], length 364
21:11:49.076648 IP 198.96.85.106.49776 > 138.197.143.231.22: Flags [.], ack 323268, win 13064, options [nop,nop,TS val 2550174111 ecr 407893811], length 0
21:11:49.174306 IP 138.197.143.231.22 > 198.96.85.106.49776: Flags [P.], seq 323268:323632, ack 3169, win 483, options [nop,nop,TS val 407893915 ecr 2550174111], length 364
21:11:49.180405 IP 198.96.85.106.49776 > 138.197.143.231.22: Flags [.], ack 323632, win 13064, options [nop,nop,TS val 2550174216 ecr 407893915], length 0
21:11:49.278314 IP 138.197.143.231.22 > 198.96.85.106.49776: Flags [P.], seq 323632:323844, ack 3169, win 483, options [nop,nop,TS val 407894019 ecr 2550174216], length 212
21:11:49.278411 IP 138.197.143.231.22 > 198.96.85.106.49776: Flags [P.], seq 323844:324040, ack 3169, win 483, options [nop,nop,TS val 407894019 ecr 2550174216], length 196
21:11:49.285078 IP 198.96.85.106.49776 > 138.197.143.231.22: Flags [.], ack 324040, win 13064, options [nop,nop,TS val 2550174319 ecr 407894019], length 0
21:11:49.382431 IP 138.197.143.231.22 > 198.96.85.106.49776: Flags [P.], seq 324040:324580, ack 3169, win 483, options [nop,nop,TS val 407894123 ecr 2550174319], length 540
21:11:49.388689 IP 198.96.85.106.49776 > 138.197.143.231.22: Flags [.], ack 324580, win 13064, options [nop,nop,TS val 2550174424 ecr 407894123], length 0
21:11:49.486248 IP 138.197.143.231.22 > 198.96.85.106.49776: Flags [P.], seq 324580:324792, ack 3169, win 483, options [nop,nop,TS val 407894227 ecr 2550174424], length 212
21:11:49.486356 IP 138.197.143.231.22 > 198.96.85.106.49776: Flags [P.], seq 324792:324988, ack 3169, win 483, options [nop,nop,TS val 407894227 ecr 2550174424], length 196
21:11:49.492653 IP 198.96.85.106.49776 > 138.197.143.231.22: Flags [.], ack 324988, win 13064, options [nop,nop,TS val 2550174527 ecr 407894227], length 0
21:11:49.590347 IP 138.197.143.231.22 > 198.96.85.106.49776: Flags [P.], seq 324988:325528, ack 3169, win 483, options [nop,nop,TS val 407894331 ecr 2550174527], length 540
21:11:49.597681 IP 198.96.85.106.49776 > 138.197.143.231.22: Flags [.], ack 325528, win 13064, options [nop,nop,TS val 2550174632 ecr 407894331], length 0
21:11:49.694295 IP 138.197.143.231.22 > 198.96.85.106.49776: Flags [P.], seq 325528:325740, ack 3169, win 483, options [nop,nop,TS val 407894435 ecr 2550174632], length 212
21:11:49.694394 IP 138.197.143.231.22 > 198.96.85.106.49776: Flags [P.], seq 325740:325936, ack 3169, win 483, options [nop,nop,TS val 407894435 ecr 2550174632], length 196
21:11:49.700388 IP 198.96.85.106.49776 > 138.197.143.231.22: Flags [.], ack 325936, win 13064, options [nop,nop,TS val 2550174735 ecr 407894435], length 0
21:11:49.798258 IP 138.197.143.231.22 > 198.96.85.106.49776: Flags [P.], seq 325936:326476, ack 3169, win 483, options [nop,nop,TS val 407894539 ecr 2550174735], length 540
21:11:49.804500 IP 198.96.85.106.49776 > 138.197.143.231.22: Flags [.], ack 326476, win 13064, options [nop,nop,TS val 2550174839 ecr 407894539], length 0
21:11:49.902275 IP 138.197.143.231.22 > 198.96.85.106.49776: Flags [P.], seq 326476:326840, ack 3169, win 483, options [nop,nop,TS val 407894643 ecr 2550174839], length 364
21:11:49.908648 IP 198.96.85.106.49776 > 138.197.143.231.22: Flags [.], ack 326840, win 13064, options [nop,nop,TS val 2550174943 ecr 407894643], length 0
21:11:50.006307 IP 138.197.143.231.22 > 198.96.85.106.49776: Flags [P.], seq 326840:327204, ack 3169, win 483, options [nop,nop,TS val 407894747 ecr 2550174943], length 364
21:11:50.013384 IP 198.96.85.106.49776 > 138.197.143.231.22: Flags [.], ack 327204, win 13064, options [nop,nop,TS val 2550175049 ecr 407894747], length 0
21:11:50.110290 IP 138.197.143.231.22 > 198.96.85.106.49776: Flags [P.], seq 327204:327416, ack 3169, win 483, options [nop,nop,TS val 407894851 ecr 2550175049], length 212
21:11:50.110384 IP 138.197.143.231.22 > 198.96.85.106.49776: Flags [P.], seq 327416:327612, ack 3169, win 483, options [nop,nop,TS val 407894851 ecr 2550175049], length 196
21:11:50.116630 IP 198.96.85.106.49776 > 138.197.143.231.22: Flags [.], ack 327612, win 13064, options [nop,nop,TS val 2550175151 ecr 407894851], length 0
21:11:50.214323 IP 138.197.143.231.22 > 198.96.85.106.49776: Flags [P.], seq 327612:328152, ack 3169, win 483, options [nop,nop,TS val 407894955 ecr 2550175151], length 540
21:11:50.220409 IP 198.96.85.106.49776 > 138.197.143.231.22: Flags [.], ack 328152, win 13064, options [nop,nop,TS val 2550175255 ecr 407894955], length 0
21:11:50.318289 IP 138.197.143.231.22 > 198.96.85.106.49776: Flags [P.], seq 328152:328516, ack 3169, win 483, options [nop,nop,TS val 407895059 ecr 2550175255], length 364
21:11:50.324460 IP 198.96.85.106.49776 > 138.197.143.231.22: Flags [.], ack 328516, win 13064, options [nop,nop,TS val 2550175359 ecr 407895059], length 0
21:11:50.422480 IP 138.197.143.231.22 > 198.96.85.106.49776: Flags [P.], seq 328516:328880, ack 3169, win 483, options [nop,nop,TS val 407895163 ecr 2550175359], length 364
21:11:50.428749 IP 198.96.85.106.49776 > 138.197.143.231.22: Flags [.], ack 328880, win 13064, options [nop,nop,TS val 2550175464 ecr 407895163], length 0
21:11:50.526339 IP 138.197.143.231.22 > 198.96.85.106.49776: Flags [P.], seq 328880:329092, ack 3169, win 483, options [nop,nop,TS val 407895267 ecr 2550175464], length 212
21:11:50.526465 IP 138.197.143.231.22 > 198.96.85.106.49776: Flags [P.], seq 329092:329288, ack 3169, win 483, options [nop,nop,TS val 407895267 ecr 2550175464], length 196
21:11:50.532796 IP 198.96.85.106.49776 > 138.197.143.231.22: Flags [.], ack 329288, win 13064, options [nop,nop,TS val 2550175568 ecr 407895267], length 0
21:11:50.630316 IP 138.197.143.231.22 > 198.96.85.106.49776: Flags [P.], seq 329288:329828, ack 3169, win 483, options [nop,nop,TS val 407895371 ecr 2550175568], length 540
21:11:50.636246 IP 198.96.85.106.49776 > 138.197.143.231.22: Flags [.], ack 329828, win 13064, options [nop,nop,TS val 2550175671 ecr 407895371], length 0
21:11:50.734238 IP 138.197.143.231.22 > 198.96.85.106.49776: Flags [P.], seq 329828:330040, ack 3169, win 483, options [nop,nop,TS val 407895475 ecr 2550175671], length 212
21:11:50.734328 IP 138.197.143.231.22 > 198.96.85.106.49776: Flags [P.], seq 330040:330236, ack 3169, win 483, options [nop,nop,TS val 407895475 ecr 2550175671], length 196
21:11:50.738885 IP 198.96.85.106.49776 > 138.197.143.231.22: Flags [.], ack 330236, win 13064, options [nop,nop,TS val 2550175774 ecr 407895475], length 0
21:11:50.838360 IP 138.197.143.231.22 > 198.96.85.106.49776: Flags [P.], seq 330236:330776, ack 3169, win 483, options [nop,nop,TS val 407895579 ecr 2550175774], length 540
21:11:50.843964 IP 198.96.85.106.49776 > 138.197.143.231.22: Flags [.], ack 330776, win 13064, options [nop,nop,TS val 2550175878 ecr 407895579], length 0
21:11:50.942312 IP 138.197.143.231.22 > 198.96.85.106.49776: Flags [P.], seq 330776:331140, ack 3169, win 483, options [nop,nop,TS val 407895683 ecr 2550175878], length 364
21:11:50.949572 IP 198.96.85.106.49776 > 138.197.143.231.22: Flags [.], ack 331140, win 13064, options [nop,nop,TS val 2550175983 ecr 407895683], length 0
21:11:51.046289 IP 138.197.143.231.22 > 198.96.85.106.49776: Flags [P.], seq 331140:331504, ack 3169, win 483, options [nop,nop,TS val 407895787 ecr 2550175983], length 364
21:11:51.068168 IP 198.96.85.106.49776 > 138.197.143.231.22: Flags [.], ack 331504, win 13064, options [nop,nop,TS val 2550176103 ecr 407895787], length 0
21:11:51.150254 IP 138.197.143.231.22 > 198.96.85.106.49776: Flags [P.], seq 331504:331716, ack 3169, win 483, options [nop,nop,TS val 407895891 ecr 2550176103], length 212
21:11:51.150337 IP 138.197.143.231.22 > 198.96.85.106.49776: Flags [P.], seq 331716:331912, ack 3169, win 483, options [nop,nop,TS val 407895891 ecr 2550176103], length 196
21:11:51.156010 IP 198.96.85.106.49776 > 138.197.143.231.22: Flags [.], ack 331912, win 13064, options [nop,nop,TS val 2550176191 ecr 407895891], length 0
21:11:51.254287 IP 138.197.143.231.22 > 198.96.85.106.49776: Flags [P.], seq 331912:332452, ack 3169, win 483, options [nop,nop,TS val 407895995 ecr 2550176191], length 540
21:11:51.260583 IP 198.96.85.106.49776 > 138.197.143.231.22: Flags [.], ack 332452, win 13064, options [nop,nop,TS val 2550176295 ecr 407895995], length 0
21:11:51.358288 IP 138.197.143.231.22 > 198.96.85.106.49776: Flags [P.], seq 332452:332664, ack 3169, win 483, options [nop,nop,TS val 407896099 ecr 2550176295], length 212
21:11:51.358382 IP 138.197.143.231.22 > 198.96.85.106.49776: Flags [P.], seq 332664:332860, ack 3169, win 483, options [nop,nop,TS val 407896099 ecr 2550176295], length 196
21:11:51.364377 IP 198.96.85.106.49776 > 138.197.143.231.22: Flags [.], ack 332860, win 13064, options [nop,nop,TS val 2550176399 ecr 407896099], length 0
21:11:51.462317 IP 138.197.143.231.22 > 198.96.85.106.49776: Flags [P.], seq 332860:333400, ack 3169, win 483, options [nop,nop,TS val 407896203 ecr 2550176399], length 540
21:11:51.468498 IP 198.96.85.106.49776 > 138.197.143.231.22: Flags [.], ack 333400, win 13064, options [nop,nop,TS val 2550176503 ecr 407896203], length 0
21:11:51.566332 IP 138.197.143.231.22 > 198.96.85.106.49776: Flags [P.], seq 333400:333612, ack 3169, win 483, options [nop,nop,TS val 407896307 ecr 2550176503], length 212
21:11:51.566448 IP 138.197.143.231.22 > 198.96.85.106.49776: Flags [P.], seq 333612:333808, ack 3169, win 483, options [nop,nop,TS val 407896307 ecr 2550176503], length 196
21:11:51.572277 IP 198.96.85.106.49776 > 138.197.143.231.22: Flags [.], ack 333808, win 13064, options [nop,nop,TS val 2550176607 ecr 407896307], length 0
21:11:51.670314 IP 138.197.143.231.22 > 198.96.85.106.49776: Flags [P.], seq 333808:334348, ack 3169, win 483, options [nop,nop,TS val 407896411 ecr 2550176607], length 540
21:11:51.676414 IP 198.96.85.106.49776 > 138.197.143.231.22: Flags [.], ack 334348, win 13064, options [nop,nop,TS val 2550176711 ecr 407896411], length 0
21:11:51.774357 IP 138.197.143.231.22 > 198.96.85.106.49776: Flags [P.], seq 334348:334560, ack 3169, win 483, options [nop,nop,TS val 407896515 ecr 2550176711], length 212
21:11:51.774478 IP 138.197.143.231.22 > 198.96.85.106.49776: Flags [P.], seq 334560:334756, ack 3169, win 483, options [nop,nop,TS val 407896515 ecr 2550176711], length 196
21:11:51.780779 IP 198.96.85.106.49776 > 138.197.143.231.22: Flags [.], ack 334756, win 13064, options [nop,nop,TS val 2550176816 ecr 407896515], length 0
21:11:51.878407 IP 138.197.143.231.22 > 198.96.85.106.49776: Flags [P.], seq 334756:335296, ack 3169, win 483, options [nop,nop,TS val 407896619 ecr 2550176816], length 540
21:11:51.884587 IP 198.96.85.106.49776 > 138.197.143.231.22: Flags [.], ack 335296, win 13064, options [nop,nop,TS val 2550176919 ecr 407896619], length 0
21:11:51.982280 IP 138.197.143.231.22 > 198.96.85.106.49776: Flags [P.], seq 335296:335660, ack 3169, win 483, options [nop,nop,TS val 407896723 ecr 2550176919], length 364
21:11:51.988717 IP 198.96.85.106.49776 > 138.197.143.231.22: Flags [.], ack 335660, win 13064, options [nop,nop,TS val 2550177023 ecr 407896723], length 0
21:11:52.086321 IP 138.197.143.231.22 > 198.96.85.106.49776: Flags [P.], seq 335660:336024, ack 3169, win 483, options [nop,nop,TS val 407896827 ecr 2550177023], length 364
21:11:52.092428 IP 198.96.85.106.49776 > 138.197.143.231.22: Flags [.], ack 336024, win 13064, options [nop,nop,TS val 2550177127 ecr 407896827], length 0
21:11:52.190410 IP 138.197.143.231.22 > 198.96.85.106.49776: Flags [P.], seq 336024:336388, ack 3169, win 483, options [nop,nop,TS val 407896931 ecr 2550177127], length 364
21:11:52.196887 IP 198.96.85.106.49776 > 138.197.143.231.22: Flags [.], ack 336388, win 13064, options [nop,nop,TS val 2550177232 ecr 407896931], length 0
21:11:52.294323 IP 138.197.143.231.22 > 198.96.85.106.49776: Flags [P.], seq 336388:336752, ack 3169, win 483, options [nop,nop,TS val 407897035 ecr 2550177232], length 364
21:11:52.310524 IP 198.96.85.106.49776 > 138.197.143.231.22: Flags [.], ack 336752, win 13064, options [nop,nop,TS val 2550177343 ecr 407897035], length 0
21:11:52.398371 IP 138.197.143.231.22 > 198.96.85.106.49776: Flags [P.], seq 336752:337116, ack 3169, win 483, options [nop,nop,TS val 407897139 ecr 2550177343], length 364
21:11:52.403925 IP 198.96.85.106.49776 > 138.197.143.231.22: Flags [.], ack 337116, win 13064, options [nop,nop,TS val 2550177439 ecr 407897139], length 0
21:11:52.502250 IP 138.197.143.231.22 > 198.96.85.106.49776: Flags [P.], seq 337116:337480, ack 3169, win 483, options [nop,nop,TS val 407897243 ecr 2550177439], length 364
21:11:52.510570 IP 198.96.85.106.49776 > 138.197.143.231.22: Flags [.], ack 337480, win 13064, options [nop,nop,TS val 2550177545 ecr 407897243], length 0
21:11:52.606318 IP 138.197.143.231.22 > 198.96.85.106.49776: Flags [P.], seq 337480:337844, ack 3169, win 483, options [nop,nop,TS val 407897347 ecr 2550177545], length 364
21:11:52.611919 IP 198.96.85.106.49776 > 138.197.143.231.22: Flags [.], ack 337844, win 13064, options [nop,nop,TS val 2550177647 ecr 407897347], length 0
21:11:52.710324 IP 138.197.143.231.22 > 198.96.85.106.49776: Flags [P.], seq 337844:338208, ack 3169, win 483, options [nop,nop,TS val 407897451 ecr 2550177647], length 364
21:11:52.715828 IP 198.96.85.106.49776 > 138.197.143.231.22: Flags [.], ack 338208, win 13064, options [nop,nop,TS val 2550177751 ecr 407897451], length 0
21:11:52.814392 IP 138.197.143.231.22 > 198.96.85.106.49776: Flags [P.], seq 338208:338572, ack 3169, win 483, options [nop,nop,TS val 407897555 ecr 2550177751], length 364
21:11:52.820508 IP 198.96.85.106.49776 > 138.197.143.231.22: Flags [.], ack 338572, win 13064, options [nop,nop,TS val 2550177855 ecr 407897555], length 0
21:11:52.918335 IP 138.197.143.231.22 > 198.96.85.106.49776: Flags [P.], seq 338572:338936, ack 3169, win 483, options [nop,nop,TS val 407897659 ecr 2550177855], length 364
21:11:52.924439 IP 198.96.85.106.49776 > 138.197.143.231.22: Flags [.], ack 338936, win 13064, options [nop,nop,TS val 2550177959 ecr 407897659], length 0
21:11:53.022279 IP 138.197.143.231.22 > 198.96.85.106.49776: Flags [P.], seq 338936:339148, ack 3169, win 483, options [nop,nop,TS val 407897763 ecr 2550177959], length 212
21:11:53.022369 IP 138.197.143.231.22 > 198.96.85.106.49776: Flags [P.], seq 339148:339344, ack 3169, win 483, options [nop,nop,TS val 407897763 ecr 2550177959], length 196
21:11:53.028534 IP 198.96.85.106.49776 > 138.197.143.231.22: Flags [.], ack 339344, win 13064, options [nop,nop,TS val 2550178063 ecr 407897763], length 0
21:11:53.126364 IP 138.197.143.231.22 > 198.96.85.106.49776: Flags [P.], seq 339344:339884, ack 3169, win 483, options [nop,nop,TS val 407897867 ecr 2550178063], length 540
21:11:53.131952 IP 198.96.85.106.49776 > 138.197.143.231.22: Flags [.], ack 339884, win 13064, options [nop,nop,TS val 2550178167 ecr 407897867], length 0
21:11:53.230282 IP 138.197.143.231.22 > 198.96.85.106.49776: Flags [P.], seq 339884:340096, ack 3169, win 483, options [nop,nop,TS val 407897971 ecr 2550178167], length 212
21:11:53.230386 IP 138.197.143.231.22 > 198.96.85.106.49776: Flags [P.], seq 340096:340292, ack 3169, win 483, options [nop,nop,TS val 407897971 ecr 2550178167], length 196
21:11:53.236365 IP 198.96.85.106.49776 > 138.197.143.231.22: Flags [.], ack 340292, win 13064, options [nop,nop,TS val 2550178271 ecr 407897971], length 0
21:11:53.334278 IP 138.197.143.231.22 > 198.96.85.106.49776: Flags [P.], seq 340292:340832, ack 3169, win 483, options [nop,nop,TS val 407898075 ecr 2550178271], length 540
21:11:53.340431 IP 198.96.85.106.49776 > 138.197.143.231.22: Flags [.], ack 340832, win 13064, options [nop,nop,TS val 2550178375 ecr 407898075], length 0
21:11:53.438307 IP 138.197.143.231.22 > 198.96.85.106.49776: Flags [P.], seq 340832:341044, ack 3169, win 483, options [nop,nop,TS val 407898179 ecr 2550178375], length 212
21:11:53.438395 IP 138.197.143.231.22 > 198.96.85.106.49776: Flags [P.], seq 341044:341240, ack 3169, win 483, options [nop,nop,TS val 407898179 ecr 2550178375], length 196
21:11:53.444580 IP 198.96.85.106.49776 > 138.197.143.231.22: Flags [.], ack 341240, win 13064, options [nop,nop,TS val 2550178479 ecr 407898179], length 0
21:11:53.542313 IP 138.197.143.231.22 > 198.96.85.106.49776: Flags [P.], seq 341240:341780, ack 3169, win 483, options [nop,nop,TS val 407898283 ecr 2550178479], length 540
21:11:53.550942 IP 198.96.85.106.49776 > 138.197.143.231.22: Flags [.], ack 341780, win 13064, options [nop,nop,TS val 2550178585 ecr 407898283], length 0
21:11:53.646282 IP 138.197.143.231.22 > 198.96.85.106.49776: Flags [P.], seq 341780:341992, ack 3169, win 483, options [nop,nop,TS val 407898387 ecr 2550178585], length 212
21:11:53.646377 IP 138.197.143.231.22 > 198.96.85.106.49776: Flags [P.], seq 341992:342188, ack 3169, win 483, options [nop,nop,TS val 407898387 ecr 2550178585], length 196
21:11:53.652515 IP 198.96.85.106.49776 > 138.197.143.231.22: Flags [.], ack 342188, win 13064, options [nop,nop,TS val 2550178687 ecr 407898387], length 0
21:11:53.750309 IP 138.197.143.231.22 > 198.96.85.106.49776: Flags [P.], seq 342188:342728, ack 3169, win 483, options [nop,nop,TS val 407898491 ecr 2550178687], length 540
21:11:53.757297 IP 198.96.85.106.49776 > 138.197.143.231.22: Flags [.], ack 342728, win 13064, options [nop,nop,TS val 2550178791 ecr 407898491], length 0
21:11:53.854381 IP 138.197.143.231.22 > 198.96.85.106.49776: Flags [P.], seq 342728:343092, ack 3169, win 483, options [nop,nop,TS val 407898595 ecr 2550178791], length 364
21:11:53.860782 IP 198.96.85.106.49776 > 138.197.143.231.22: Flags [.], ack 343092, win 13064, options [nop,nop,TS val 2550178896 ecr 407898595], length 0
21:11:53.958294 IP 138.197.143.231.22 > 198.96.85.106.49776: Flags [P.], seq 343092:343456, ack 3169, win 483, options [nop,nop,TS val 407898699 ecr 2550178896], length 364
21:11:53.964891 IP 198.96.85.106.49776 > 138.197.143.231.22: Flags [.], ack 343456, win 13064, options [nop,nop,TS val 2550178999 ecr 407898699], length 0
21:11:54.062361 IP 138.197.143.231.22 > 198.96.85.106.49776: Flags [P.], seq 343456:343820, ack 3169, win 483, options [nop,nop,TS val 407898803 ecr 2550178999], length 364
21:11:54.068887 IP 198.96.85.106.49776 > 138.197.143.231.22: Flags [.], ack 343820, win 13064, options [nop,nop,TS val 2550179103 ecr 407898803], length 0
21:11:54.166338 IP 138.197.143.231.22 > 198.96.85.106.49776: Flags [P.], seq 343820:344184, ack 3169, win 483, options [nop,nop,TS val 407898907 ecr 2550179103], length 364
21:11:54.173162 IP 198.96.85.106.49776 > 138.197.143.231.22: Flags [.], ack 344184, win 13064, options [nop,nop,TS val 2550179208 ecr 407898907], length 0
21:11:54.270292 IP 138.197.143.231.22 > 198.96.85.106.49776: Flags [P.], seq 344184:344548, ack 3169, win 483, options [nop,nop,TS val 407899011 ecr 2550179208], length 364
21:11:54.276641 IP 198.96.85.106.49776 > 138.197.143.231.22: Flags [.], ack 344548, win 13064, options [nop,nop,TS val 2550179311 ecr 407899011], length 0
21:11:54.374292 IP 138.197.143.231.22 > 198.96.85.106.49776: Flags [P.], seq 344548:344912, ack 3169, win 483, options [nop,nop,TS val 407899115 ecr 2550179311], length 364
21:11:54.380233 IP 198.96.85.106.49776 > 138.197.143.231.22: Flags [.], ack 344912, win 13064, options [nop,nop,TS val 2550179415 ecr 407899115], length 0
21:11:54.478267 IP 138.197.143.231.22 > 198.96.85.106.49776: Flags [P.], seq 344912:345276, ack 3169, win 483, options [nop,nop,TS val 407899219 ecr 2550179415], length 364
21:11:54.484571 IP 198.96.85.106.49776 > 138.197.143.231.22: Flags [.], ack 345276, win 13064, options [nop,nop,TS val 2550179519 ecr 407899219], length 0
21:11:54.587242 IP 138.197.143.231.22 > 198.96.85.106.49776: Flags [P.], seq 345276:345640, ack 3169, win 483, options [nop,nop,TS val 407899328 ecr 2550179519], length 364
21:11:54.595438 IP 198.96.85.106.49776 > 138.197.143.231.22: Flags [.], ack 345640, win 13064, options [nop,nop,TS val 2550179630 ecr 407899328], length 0
21:11:54.694333 IP 138.197.143.231.22 > 198.96.85.106.49776: Flags [P.], seq 345640:345852, ack 3169, win 483, options [nop,nop,TS val 407899435 ecr 2550179630], length 212
21:11:54.694467 IP 138.197.143.231.22 > 198.96.85.106.49776: Flags [P.], seq 345852:346048, ack 3169, win 483, options [nop,nop,TS val 407899435 ecr 2550179630], length 196
21:11:54.700572 IP 198.96.85.106.49776 > 138.197.143.231.22: Flags [.], ack 346048, win 13064, options [nop,nop,TS val 2550179735 ecr 407899435], length 0
21:11:54.798296 IP 138.197.143.231.22 > 198.96.85.106.49776: Flags [P.], seq 346048:346588, ack 3169, win 483, options [nop,nop,TS val 407899539 ecr 2550179735], length 540
21:11:54.820658 IP 198.96.85.106.49776 > 138.197.143.231.22: Flags [.], ack 346588, win 13064, options [nop,nop,TS val 2550179852 ecr 407899539], length 0
21:11:54.902247 IP 138.197.143.231.22 > 198.96.85.106.49776: Flags [P.], seq 346588:346952, ack 3169, win 483, options [nop,nop,TS val 407899643 ecr 2550179852], length 364
21:11:54.908517 IP 198.96.85.106.49776 > 138.197.143.231.22: Flags [.], ack 346952, win 13064, options [nop,nop,TS val 2550179943 ecr 407899643], length 0
21:11:55.006376 IP 138.197.143.231.22 > 198.96.85.106.49776: Flags [P.], seq 346952:347164, ack 3169, win 483, options [nop,nop,TS val 407899747 ecr 2550179943], length 212
21:11:55.006496 IP 138.197.143.231.22 > 198.96.85.106.49776: Flags [P.], seq 347164:347360, ack 3169, win 483, options [nop,nop,TS val 407899747 ecr 2550179943], length 196
21:11:55.013342 IP 198.96.85.106.49776 > 138.197.143.231.22: Flags [.], ack 347360, win 13064, options [nop,nop,TS val 2550180048 ecr 407899747], length 0
21:11:55.110340 IP 138.197.143.231.22 > 198.96.85.106.49776: Flags [P.], seq 347360:347572, ack 3169, win 483, options [nop,nop,TS val 407899851 ecr 2550180048], length 212
21:11:55.110504 IP 138.197.143.231.22 > 198.96.85.106.49776: Flags [P.], seq 347572:347936, ack 3169, win 483, options [nop,nop,TS val 407899851 ecr 2550180048], length 364
21:11:55.116481 IP 198.96.85.106.49776 > 138.197.143.231.22: Flags [.], ack 347936, win 13064, options [nop,nop,TS val 2550180151 ecr 407899851], length 0
21:11:55.214319 IP 138.197.143.231.22 > 198.96.85.106.49776: Flags [P.], seq 347936:348476, ack 3169, win 483, options [nop,nop,TS val 407899955 ecr 2550180151], length 540
21:11:55.220861 IP 198.96.85.106.49776 > 138.197.143.231.22: Flags [.], ack 348476, win 13064, options [nop,nop,TS val 2550180255 ecr 407899955], length 0
21:11:55.318251 IP 138.197.143.231.22 > 198.96.85.106.49776: Flags [P.], seq 348476:348688, ack 3169, win 483, options [nop,nop,TS val 407900059 ecr 2550180255], length 212
21:11:55.318342 IP 138.197.143.231.22 > 198.96.85.106.49776: Flags [P.], seq 348688:348884, ack 3169, win 483, options [nop,nop,TS val 407900059 ecr 2550180255], length 196
21:11:55.324193 IP 198.96.85.106.49776 > 138.197.143.231.22: Flags [.], ack 348884, win 13064, options [nop,nop,TS val 2550180358 ecr 407900059], length 0
21:11:55.324689 IP 198.96.85.106.49776 > 138.197.143.231.22: Flags [P.], seq 3169:3205, ack 348884, win 13064, options [nop,nop,TS val 2550180358 ecr 407900059], length 36
21:11:55.324719 IP 138.197.143.231.22 > 198.96.85.106.49776: Flags [.], ack 3205, win 483, options [nop,nop,TS val 407900065 ecr 2550180358], length 0
21:11:55.422363 IP 138.197.143.231.22 > 198.96.85.106.49776: Flags [P.], seq 348884:349752, ack 3205, win 483, options [nop,nop,TS val 407900163 ecr 2550180358], length 868
21:11:55.427221 IP 198.96.85.106.49776 > 138.197.143.231.22: Flags [.], ack 349752, win 13064, options [nop,nop,TS val 2550180463 ecr 407900163], length 0
21:11:55.526330 IP 138.197.143.231.22 > 198.96.85.106.49776: Flags [P.], seq 349752:349964, ack 3205, win 483, options [nop,nop,TS val 407900267 ecr 2550180463], length 212
21:11:55.526462 IP 138.197.143.231.22 > 198.96.85.106.49776: Flags [P.], seq 349964:350160, ack 3205, win 483, options [nop,nop,TS val 407900267 ecr 2550180463], length 196
21:11:55.531545 IP 198.96.85.106.49776 > 138.197.143.231.22: Flags [.], ack 350160, win 13064, options [nop,nop,TS val 2550180567 ecr 407900267], length 0
21:11:55.630404 IP 138.197.143.231.22 > 198.96.85.106.49776: Flags [P.], seq 350160:350700, ack 3205, win 483, options [nop,nop,TS val 407900371 ecr 2550180567], length 540
21:11:55.635320 IP 198.96.85.106.49776 > 138.197.143.231.22: Flags [.], ack 350700, win 13064, options [nop,nop,TS val 2550180671 ecr 407900371], length 0
21:11:55.734282 IP 138.197.143.231.22 > 198.96.85.106.49776: Flags [P.], seq 350700:350912, ack 3205, win 483, options [nop,nop,TS val 407900475 ecr 2550180671], length 212
21:11:55.734382 IP 138.197.143.231.22 > 198.96.85.106.49776: Flags [P.], seq 350912:351108, ack 3205, win 483, options [nop,nop,TS val 407900475 ecr 2550180671], length 196
21:11:55.740999 IP 198.96.85.106.49776 > 138.197.143.231.22: Flags [.], ack 351108, win 13064, options [nop,nop,TS val 2550180776 ecr 407900475], length 0
21:11:55.838355 IP 138.197.143.231.22 > 198.96.85.106.49776: Flags [P.], seq 351108:351648, ack 3205, win 483, options [nop,nop,TS val 407900579 ecr 2550180776], length 540
21:11:55.844338 IP 198.96.85.106.49776 > 138.197.143.231.22: Flags [.], ack 351648, win 13064, options [nop,nop,TS val 2550180879 ecr 407900579], length 0
21:11:55.885426 IP 178.62.221.97.42284 > 138.197.143.231.22: Flags [S], seq 2649801495, win 64240, options [mss 1460,sackOK,TS val 2638044977 ecr 0,nop,wscale 7], length 0
21:11:55.885506 IP 138.197.143.231 > 178.62.221.97: ICMP 138.197.143.231 tcp port 22 unreachable, length 68
21:11:55.942323 IP 138.197.143.231.22 > 198.96.85.106.49776: Flags [P.], seq 351648:351860, ack 3205, win 483, options [nop,nop,TS val 407900683 ecr 2550180879], length 212
21:11:55.942479 IP 138.197.143.231.22 > 198.96.85.106.49776: Flags [P.], seq 351860:352336, ack 3205, win 483, options [nop,nop,TS val 407900683 ecr 2550180879], length 476
21:11:55.950943 IP 198.96.85.106.49776 > 138.197.143.231.22: Flags [.], ack 352336, win 13064, options [nop,nop,TS val 2550180986 ecr 407900683], length 0
21:11:56.046320 IP 138.197.143.231.22 > 198.96.85.106.49776: Flags [P.], seq 352336:352876, ack 3205, win 483, options [nop,nop,TS val 407900787 ecr 2550180986], length 540
21:11:56.051639 IP 198.96.85.106.49776 > 138.197.143.231.22: Flags [.], ack 352876, win 13064, options [nop,nop,TS val 2550181086 ecr 407900787], length 0
21:11:56.150278 IP 138.197.143.231.22 > 198.96.85.106.49776: Flags [P.], seq 352876:353088, ack 3205, win 483, options [nop,nop,TS val 407900891 ecr 2550181086], length 212
21:11:56.150360 IP 138.197.143.231.22 > 198.96.85.106.49776: Flags [P.], seq 353088:353284, ack 3205, win 483, options [nop,nop,TS val 407900891 ecr 2550181086], length 196
21:11:56.156424 IP 198.96.85.106.49776 > 138.197.143.231.22: Flags [.], ack 353284, win 13064, options [nop,nop,TS val 2550181191 ecr 407900891], length 0
21:11:56.254307 IP 138.197.143.231.22 > 198.96.85.106.49776: Flags [P.], seq 353284:353824, ack 3205, win 483, options [nop,nop,TS val 407900995 ecr 2550181191], length 540
21:11:56.260346 IP 198.96.85.106.49776 > 138.197.143.231.22: Flags [.], ack 353824, win 13064, options [nop,nop,TS val 2550181295 ecr 407900995], length 0
21:11:56.358284 IP 138.197.143.231.22 > 198.96.85.106.49776: Flags [P.], seq 353824:354036, ack 3205, win 483, options [nop,nop,TS val 407901099 ecr 2550181295], length 212
21:11:56.358378 IP 138.197.143.231.22 > 198.96.85.106.49776: Flags [P.], seq 354036:354232, ack 3205, win 483, options [nop,nop,TS val 407901099 ecr 2550181295], length 196
21:11:56.363375 IP 198.96.85.106.49776 > 138.197.143.231.22: Flags [.], ack 354232, win 13064, options [nop,nop,TS val 2550181398 ecr 407901099], length 0
21:11:56.462302 IP 138.197.143.231.22 > 198.96.85.106.49776: Flags [P.], seq 354232:354444, ack 3205, win 483, options [nop,nop,TS val 407901203 ecr 2550181398], length 212
21:11:56.462395 IP 138.197.143.231.22 > 198.96.85.106.49776: Flags [P.], seq 354444:354808, ack 3205, win 483, options [nop,nop,TS val 407901203 ecr 2550181398], length 364
21:11:56.468462 IP 198.96.85.106.49776 > 138.197.143.231.22: Flags [.], ack 354808, win 13064, options [nop,nop,TS val 2550181503 ecr 407901203], length 0
21:11:56.566302 IP 138.197.143.231.22 > 198.96.85.106.49776: Flags [P.], seq 354808:355020, ack 3205, win 483, options [nop,nop,TS val 407901307 ecr 2550181503], length 212
21:11:56.566424 IP 138.197.143.231.22 > 198.96.85.106.49776: Flags [P.], seq 355020:355384, ack 3205, win 483, options [nop,nop,TS val 407901307 ecr 2550181503], length 364
21:11:56.572208 IP 198.96.85.106.49776 > 138.197.143.231.22: Flags [.], ack 355384, win 13064, options [nop,nop,TS val 2550181607 ecr 407901307], length 0
21:11:56.670376 IP 138.197.143.231.22 > 198.96.85.106.49776: Flags [P.], seq 355384:355924, ack 3205, win 483, options [nop,nop,TS val 407901411 ecr 2550181607], length 540
21:11:56.676319 IP 198.96.85.106.49776 > 138.197.143.231.22: Flags [.], ack 355924, win 13064, options [nop,nop,TS val 2550181711 ecr 407901411], length 0
21:11:56.774285 IP 138.197.143.231.22 > 198.96.85.106.49776: Flags [P.], seq 355924:356136, ack 3205, win 483, options [nop,nop,TS val 407901515 ecr 2550181711], length 212
21:11:56.774375 IP 138.197.143.231.22 > 198.96.85.106.49776: Flags [P.], seq 356136:356332, ack 3205, win 483, options [nop,nop,TS val 407901515 ecr 2550181711], length 196
21:11:56.780731 IP 198.96.85.106.49776 > 138.197.143.231.22: Flags [.], ack 356332, win 13064, options [nop,nop,TS val 2550181815 ecr 407901515], length 0
21:11:56.878318 IP 138.197.143.231.22 > 198.96.85.106.49776: Flags [P.], seq 356332:356872, ack 3205, win 483, options [nop,nop,TS val 407901619 ecr 2550181815], length 540
21:11:56.884681 IP 198.96.85.106.49776 > 138.197.143.231.22: Flags [.], ack 356872, win 13064, options [nop,nop,TS val 2550181919 ecr 407901619], length 0
21:11:56.982334 IP 138.197.143.231.22 > 198.96.85.106.49776: Flags [P.], seq 356872:357236, ack 3205, win 483, options [nop,nop,TS val 407901723 ecr 2550181919], length 364
21:11:56.988688 IP 198.96.85.106.49776 > 138.197.143.231.22: Flags [.], ack 357236, win 13064, options [nop,nop,TS val 2550182023 ecr 407901723], length 0
21:11:57.086337 IP 138.197.143.231.22 > 198.96.85.106.49776: Flags [P.], seq 357236:357600, ack 3205, win 483, options [nop,nop,TS val 407901827 ecr 2550182023], length 364
21:11:57.092721 IP 198.96.85.106.49776 > 138.197.143.231.22: Flags [.], ack 357600, win 13064, options [nop,nop,TS val 2550182127 ecr 407901827], length 0
21:11:57.190386 IP 138.197.143.231.22 > 198.96.85.106.49776: Flags [P.], seq 357600:357964, ack 3205, win 483, options [nop,nop,TS val 407901931 ecr 2550182127], length 364
21:11:57.196501 IP 198.96.85.106.49776 > 138.197.143.231.22: Flags [.], ack 357964, win 13064, options [nop,nop,TS val 2550182232 ecr 407901931], length 0
21:11:57.294423 IP 138.197.143.231.22 > 198.96.85.106.49776: Flags [P.], seq 357964:358328, ack 3205, win 483, options [nop,nop,TS val 407902035 ecr 2550182232], length 364
21:11:57.300476 IP 198.96.85.106.49776 > 138.197.143.231.22: Flags [.], ack 358328, win 13064, options [nop,nop,TS val 2550182335 ecr 407902035], length 0
21:11:57.398291 IP 138.197.143.231.22 > 198.96.85.106.49776: Flags [P.], seq 358328:358692, ack 3205, win 483, options [nop,nop,TS val 407902139 ecr 2550182335], length 364
21:11:57.404746 IP 198.96.85.106.49776 > 138.197.143.231.22: Flags [.], ack 358692, win 13064, options [nop,nop,TS val 2550182440 ecr 407902139], length 0
21:11:57.502277 IP 138.197.143.231.22 > 198.96.85.106.49776: Flags [P.], seq 358692:359056, ack 3205, win 483, options [nop,nop,TS val 407902243 ecr 2550182440], length 364
21:11:57.508544 IP 198.96.85.106.49776 > 138.197.143.231.22: Flags [.], ack 359056, win 13064, options [nop,nop,TS val 2550182543 ecr 407902243], length 0
21:11:57.606310 IP 138.197.143.231.22 > 198.96.85.106.49776: Flags [P.], seq 359056:359420, ack 3205, win 483, options [nop,nop,TS val 407902347 ecr 2550182543], length 364
21:11:57.612485 IP 198.96.85.106.49776 > 138.197.143.231.22: Flags [.], ack 359420, win 13064, options [nop,nop,TS val 2550182647 ecr 407902347], length 0
21:11:57.710352 IP 138.197.143.231.22 > 198.96.85.106.49776: Flags [P.], seq 359420:359784, ack 3205, win 483, options [nop,nop,TS val 407902451 ecr 2550182647], length 364
21:11:57.716404 IP 198.96.85.106.49776 > 138.197.143.231.22: Flags [.], ack 359784, win 13064, options [nop,nop,TS val 2550182751 ecr 407902451], length 0
21:11:57.814342 IP 138.197.143.231.22 > 198.96.85.106.49776: Flags [P.], seq 359784:360148, ack 3205, win 483, options [nop,nop,TS val 407902555 ecr 2550182751], length 364
21:11:57.819416 IP 198.96.85.106.49776 > 138.197.143.231.22: Flags [.], ack 360148, win 13064, options [nop,nop,TS val 2550182855 ecr 407902555], length 0
21:11:57.918345 IP 138.197.143.231.22 > 198.96.85.106.49776: Flags [P.], seq 360148:360360, ack 3205, win 483, options [nop,nop,TS val 407902659 ecr 2550182855], length 212
21:11:57.918419 IP 138.197.143.231.22 > 198.96.85.106.49776: Flags [P.], seq 360360:360556, ack 3205, win 483, options [nop,nop,TS val 407902659 ecr 2550182855], length 196
21:11:57.924836 IP 198.96.85.106.49776 > 138.197.143.231.22: Flags [.], ack 360556, win 13064, options [nop,nop,TS val 2550182960 ecr 407902659], length 0
21:11:58.022337 IP 138.197.143.231.22 > 198.96.85.106.49776: Flags [P.], seq 360556:360768, ack 3205, win 483, options [nop,nop,TS val 407902763 ecr 2550182960], length 212
21:11:58.022471 IP 138.197.143.231.22 > 198.96.85.106.49776: Flags [P.], seq 360768:361132, ack 3205, win 483, options [nop,nop,TS val 407902763 ecr 2550182960], length 364
21:11:58.028621 IP 198.96.85.106.49776 > 138.197.143.231.22: Flags [.], ack 361132, win 13064, options [nop,nop,TS val 2550183063 ecr 407902763], length 0
21:11:58.126305 IP 138.197.143.231.22 > 198.96.85.106.49776: Flags [P.], seq 361132:361672, ack 3205, win 483, options [nop,nop,TS val 407902867 ecr 2550183063], length 540
21:11:58.132368 IP 198.96.85.106.49776 > 138.197.143.231.22: Flags [.], ack 361672, win 13064, options [nop,nop,TS val 2550183167 ecr 407902867], length 0
21:11:58.230325 IP 138.197.143.231.22 > 198.96.85.106.49776: Flags [P.], seq 361672:361884, ack 3205, win 483, options [nop,nop,TS val 407902971 ecr 2550183167], length 212
21:11:58.230434 IP 138.197.143.231.22 > 198.96.85.106.49776: Flags [P.], seq 361884:362080, ack 3205, win 483, options [nop,nop,TS val 407902971 ecr 2550183167], length 196
21:11:58.236632 IP 198.96.85.106.49776 > 138.197.143.231.22: Flags [.], ack 362080, win 13064, options [nop,nop,TS val 2550183271 ecr 407902971], length 0
21:11:58.334366 IP 138.197.143.231.22 > 198.96.85.106.49776: Flags [P.], seq 362080:362620, ack 3205, win 483, options [nop,nop,TS val 407903075 ecr 2550183271], length 540
21:11:58.340457 IP 198.96.85.106.49776 > 138.197.143.231.22: Flags [.], ack 362620, win 13064, options [nop,nop,TS val 2550183375 ecr 407903075], length 0
21:11:58.438324 IP 138.197.143.231.22 > 198.96.85.106.49776: Flags [P.], seq 362620:362832, ack 3205, win 483, options [nop,nop,TS val 407903179 ecr 2550183375], length 212
21:11:58.438441 IP 138.197.143.231.22 > 198.96.85.106.49776: Flags [P.], seq 362832:363028, ack 3205, win 483, options [nop,nop,TS val 407903179 ecr 2550183375], length 196
21:11:58.444595 IP 198.96.85.106.49776 > 138.197.143.231.22: Flags [.], ack 363028, win 13064, options [nop,nop,TS val 2550183479 ecr 407903179], length 0
21:11:58.542274 IP 138.197.143.231.22 > 198.96.85.106.49776: Flags [P.], seq 363028:363568, ack 3205, win 483, options [nop,nop,TS val 407903283 ecr 2550183479], length 540
21:11:58.548303 IP 198.96.85.106.49776 > 138.197.143.231.22: Flags [.], ack 363568, win 13064, options [nop,nop,TS val 2550183583 ecr 407903283], length 0
21:11:58.646365 IP 138.197.143.231.22 > 198.96.85.106.49776: Flags [P.], seq 363568:363780, ack 3205, win 483, options [nop,nop,TS val 407903387 ecr 2550183583], length 212
21:11:58.646478 IP 138.197.143.231.22 > 198.96.85.106.49776: Flags [P.], seq 363780:363976, ack 3205, win 483, options [nop,nop,TS val 407903387 ecr 2550183583], length 196
21:11:58.652374 IP 198.96.85.106.49776 > 138.197.143.231.22: Flags [.], ack 363976, win 13064, options [nop,nop,TS val 2550183687 ecr 407903387], length 0
21:11:58.750309 IP 138.197.143.231.22 > 198.96.85.106.49776: Flags [P.], seq 363976:364516, ack 3205, win 483, options [nop,nop,TS val 407903491 ecr 2550183687], length 540
21:11:58.757378 IP 198.96.85.106.49776 > 138.197.143.231.22: Flags [.], ack 364516, win 13064, options [nop,nop,TS val 2550183792 ecr 407903491], length 0
21:11:58.854305 IP 138.197.143.231.22 > 198.96.85.106.49776: Flags [P.], seq 364516:364880, ack 3205, win 483, options [nop,nop,TS val 407903595 ecr 2550183792], length 364
21:11:58.860564 IP 198.96.85.106.49776 > 138.197.143.231.22: Flags [.], ack 364880, win 13064, options [nop,nop,TS val 2550183895 ecr 407903595], length 0
21:11:58.958347 IP 138.197.143.231.22 > 198.96.85.106.49776: Flags [P.], seq 364880:365244, ack 3205, win 483, options [nop,nop,TS val 407903699 ecr 2550183895], length 364
21:11:58.964695 IP 198.96.85.106.49776 > 138.197.143.231.22: Flags [.], ack 365244, win 13064, options [nop,nop,TS val 2550183999 ecr 407903699], length 0
21:11:59.062274 IP 138.197.143.231.22 > 198.96.85.106.49776: Flags [P.], seq 365244:365608, ack 3205, win 483, options [nop,nop,TS val 407903803 ecr 2550183999], length 364
21:11:59.068203 IP 198.96.85.106.49776 > 138.197.143.231.22: Flags [.], ack 365608, win 13064, options [nop,nop,TS val 2550184103 ecr 407903803], length 0
21:11:59.166349 IP 138.197.143.231.22 > 198.96.85.106.49776: Flags [P.], seq 365608:365972, ack 3205, win 483, options [nop,nop,TS val 407903907 ecr 2550184103], length 364
21:11:59.172103 IP 198.96.85.106.49776 > 138.197.143.231.22: Flags [.], ack 365972, win 13064, options [nop,nop,TS val 2550184207 ecr 407903907], length 0
21:11:59.270339 IP 138.197.143.231.22 > 198.96.85.106.49776: Flags [P.], seq 365972:366336, ack 3205, win 483, options [nop,nop,TS val 407904011 ecr 2550184207], length 364
21:11:59.276660 IP 198.96.85.106.49776 > 138.197.143.231.22: Flags [.], ack 366336, win 13064, options [nop,nop,TS val 2550184311 ecr 407904011], length 0
21:11:59.374287 IP 138.197.143.231.22 > 198.96.85.106.49776: Flags [P.], seq 366336:366700, ack 3205, win 483, options [nop,nop,TS val 407904115 ecr 2550184311], length 364
21:11:59.380751 IP 198.96.85.106.49776 > 138.197.143.231.22: Flags [.], ack 366700, win 13064, options [nop,nop,TS val 2550184415 ecr 407904115], length 0
21:11:59.478391 IP 138.197.143.231.22 > 198.96.85.106.49776: Flags [P.], seq 366700:367064, ack 3205, win 483, options [nop,nop,TS val 407904219 ecr 2550184415], length 364
21:11:59.484744 IP 198.96.85.106.49776 > 138.197.143.231.22: Flags [.], ack 367064, win 13064, options [nop,nop,TS val 2550184519 ecr 407904219], length 0
21:11:59.582299 IP 138.197.143.231.22 > 198.96.85.106.49776: Flags [P.], seq 367064:367428, ack 3205, win 483, options [nop,nop,TS val 407904323 ecr 2550184519], length 364
21:11:59.588510 IP 198.96.85.106.49776 > 138.197.143.231.22: Flags [.], ack 367428, win 13064, options [nop,nop,TS val 2550184623 ecr 407904323], length 0
21:11:59.686323 IP 138.197.143.231.22 > 198.96.85.106.49776: Flags [P.], seq 367428:367640, ack 3205, win 483, options [nop,nop,TS val 407904427 ecr 2550184623], length 212
21:11:59.686465 IP 138.197.143.231.22 > 198.96.85.106.49776: Flags [P.], seq 367640:367836, ack 3205, win 483, options [nop,nop,TS val 407904427 ecr 2550184623], length 196
21:11:59.692100 IP 198.96.85.106.49776 > 138.197.143.231.22: Flags [.], ack 367836, win 13064, options [nop,nop,TS val 2550184727 ecr 407904427], length 0
21:11:59.790279 IP 138.197.143.231.22 > 198.96.85.106.49776: Flags [P.], seq 367836:368376, ack 3205, win 483, options [nop,nop,TS val 407904531 ecr 2550184727], length 540
21:11:59.796559 IP 198.96.85.106.49776 > 138.197.143.231.22: Flags [.], ack 368376, win 13064, options [nop,nop,TS val 2550184831 ecr 407904531], length 0
21:11:59.894279 IP 138.197.143.231.22 > 198.96.85.106.49776: Flags [P.], seq 368376:368588, ack 3205, win 483, options [nop,nop,TS val 407904635 ecr 2550184831], length 212
21:11:59.894384 IP 138.197.143.231.22 > 198.96.85.106.49776: Flags [P.], seq 368588:368784, ack 3205, win 483, options [nop,nop,TS val 407904635 ecr 2550184831], length 196
21:11:59.900424 IP 198.96.85.106.49776 > 138.197.143.231.22: Flags [.], ack 368784, win 13064, options [nop,nop,TS val 2550184935 ecr 407904635], length 0
21:11:59.998449 IP 138.197.143.231.22 > 198.96.85.106.49776: Flags [P.], seq 368784:369324, ack 3205, win 483, options [nop,nop,TS val 407904739 ecr 2550184935], length 540
21:12:00.004873 IP 198.96.85.106.49776 > 138.197.143.231.22: Flags [.], ack 369324, win 13064, options [nop,nop,TS val 2550185040 ecr 407904739], length 0
21:12:00.102320 IP 138.197.143.231.22 > 198.96.85.106.49776: Flags [P.], seq 369324:369688, ack 3205, win 483, options [nop,nop,TS val 407904843 ecr 2550185040], length 364
21:12:00.108537 IP 198.96.85.106.49776 > 138.197.143.231.22: Flags [.], ack 369688, win 13064, options [nop,nop,TS val 2550185143 ecr 407904843], length 0
21:12:00.206263 IP 138.197.143.231.22 > 198.96.85.106.49776: Flags [P.], seq 369688:370052, ack 3205, win 483, options [nop,nop,TS val 407904947 ecr 2550185143], length 364
21:12:00.207792 IP 49.37.251.63.37728 > 138.197.143.231.22: Flags [S], seq 3762657469, win 64240, options [mss 1460,sackOK,TS val 522158694 ecr 0,nop,wscale 7], length 0
21:12:00.207841 IP 138.197.143.231 > 49.37.251.63: ICMP 138.197.143.231 tcp port 22 unreachable, length 68
21:12:00.212725 IP 198.96.85.106.49776 > 138.197.143.231.22: Flags [.], ack 370052, win 13064, options [nop,nop,TS val 2550185247 ecr 407904947], length 0
21:12:00.310353 IP 138.197.143.231.22 > 198.96.85.106.49776: Flags [P.], seq 370052:370696, ack 3205, win 483, options [nop,nop,TS val 407905051 ecr 2550185247], length 644
21:12:00.316428 IP 198.96.85.106.49776 > 138.197.143.231.22: Flags [.], ack 370696, win 13064, options [nop,nop,TS val 2550185351 ecr 407905051], length 0
21:12:00.414333 IP 138.197.143.231.22 > 198.96.85.106.49776: Flags [P.], seq 370696:371060, ack 3205, win 483, options [nop,nop,TS val 407905155 ecr 2550185351], length 364
21:12:00.419762 IP 198.96.85.106.49776 > 138.197.143.231.22: Flags [.], ack 371060, win 13064, options [nop,nop,TS val 2550185455 ecr 407905155], length 0
21:12:00.518348 IP 138.197.143.231.22 > 198.96.85.106.49776: Flags [P.], seq 371060:371424, ack 3205, win 483, options [nop,nop,TS val 407905259 ecr 2550185455], length 364
21:12:00.524805 IP 198.96.85.106.49776 > 138.197.143.231.22: Flags [.], ack 371424, win 13064, options [nop,nop,TS val 2550185560 ecr 407905259], length 0
21:12:00.622346 IP 138.197.143.231.22 > 198.96.85.106.49776: Flags [P.], seq 371424:371788, ack 3205, win 483, options [nop,nop,TS val 407905363 ecr 2550185560], length 364
21:12:00.628944 IP 198.96.85.106.49776 > 138.197.143.231.22: Flags [.], ack 371788, win 13064, options [nop,nop,TS val 2550185664 ecr 407905363], length 0
21:12:00.726279 IP 138.197.143.231.22 > 198.96.85.106.49776: Flags [P.], seq 371788:372000, ack 3205, win 483, options [nop,nop,TS val 407905467 ecr 2550185664], length 212
21:12:00.726402 IP 138.197.143.231.22 > 198.96.85.106.49776: Flags [P.], seq 372000:372196, ack 3205, win 483, options [nop,nop,TS val 407905467 ecr 2550185664], length 196
21:12:00.732481 IP 198.96.85.106.49776 > 138.197.143.231.22: Flags [.], ack 372196, win 13064, options [nop,nop,TS val 2550185767 ecr 407905467], length 0
21:12:00.830320 IP 138.197.143.231.22 > 198.96.85.106.49776: Flags [P.], seq 372196:372736, ack 3205, win 483, options [nop,nop,TS val 407905571 ecr 2550185767], length 540
21:12:00.837958 IP 198.96.85.106.49776 > 138.197.143.231.22: Flags [.], ack 372736, win 13064, options [nop,nop,TS val 2550185871 ecr 407905571], length 0
21:12:00.934288 IP 138.197.143.231.22 > 198.96.85.106.49776: Flags [P.], seq 372736:372948, ack 3205, win 483, options [nop,nop,TS val 407905675 ecr 2550185871], length 212
21:12:00.934380 IP 138.197.143.231.22 > 198.96.85.106.49776: Flags [P.], seq 372948:373144, ack 3205, win 483, options [nop,nop,TS val 407905675 ecr 2550185871], length 196
21:12:00.942610 IP 198.96.85.106.49776 > 138.197.143.231.22: Flags [.], ack 373144, win 13064, options [nop,nop,TS val 2550185978 ecr 407905675], length 0
21:12:01.038296 IP 138.197.143.231.22 > 198.96.85.106.49776: Flags [P.], seq 373144:373684, ack 3205, win 483, options [nop,nop,TS val 407905779 ecr 2550185978], length 540
21:12:01.046829 IP 198.96.85.106.49776 > 138.197.143.231.22: Flags [.], ack 373684, win 13064, options [nop,nop,TS val 2550186082 ecr 407905779], length 0
21:12:01.142326 IP 138.197.143.231.22 > 198.96.85.106.49776: Flags [P.], seq 373684:374048, ack 3205, win 483, options [nop,nop,TS val 407905883 ecr 2550186082], length 364
21:12:01.148506 IP 198.96.85.106.49776 > 138.197.143.231.22: Flags [.], ack 374048, win 13064, options [nop,nop,TS val 2550186183 ecr 407905883], length 0
21:12:01.246345 IP 138.197.143.231.22 > 198.96.85.106.49776: Flags [P.], seq 374048:374412, ack 3205, win 483, options [nop,nop,TS val 407905987 ecr 2550186183], length 364
21:12:01.252696 IP 198.96.85.106.49776 > 138.197.143.231.22: Flags [.], ack 374412, win 13064, options [nop,nop,TS val 2550186287 ecr 407905987], length 0
21:12:01.350399 IP 138.197.143.231.22 > 198.96.85.106.49776: Flags [P.], seq 374412:374776, ack 3205, win 483, options [nop,nop,TS val 407906091 ecr 2550186287], length 364
21:12:01.356746 IP 198.96.85.106.49776 > 138.197.143.231.22: Flags [.], ack 374776, win 13064, options [nop,nop,TS val 2550186391 ecr 407906091], length 0
21:12:01.454365 IP 138.197.143.231.22 > 198.96.85.106.49776: Flags [P.], seq 374776:375140, ack 3205, win 483, options [nop,nop,TS val 407906195 ecr 2550186391], length 364
21:12:01.460545 IP 198.96.85.106.49776 > 138.197.143.231.22: Flags [.], ack 375140, win 13064, options [nop,nop,TS val 2550186495 ecr 407906195], length 0
21:12:01.558355 IP 138.197.143.231.22 > 198.96.85.106.49776: Flags [P.], seq 375140:375504, ack 3205, win 483, options [nop,nop,TS val 407906299 ecr 2550186495], length 364
21:12:01.565111 IP 198.96.85.106.49776 > 138.197.143.231.22: Flags [.], ack 375504, win 13064, options [nop,nop,TS val 2550186600 ecr 407906299], length 0
21:12:01.662378 IP 138.197.143.231.22 > 198.96.85.106.49776: Flags [P.], seq 375504:375868, ack 3205, win 483, options [nop,nop,TS val 407906403 ecr 2550186600], length 364
21:12:01.668360 IP 198.96.85.106.49776 > 138.197.143.231.22: Flags [.], ack 375868, win 13064, options [nop,nop,TS val 2550186703 ecr 407906403], length 0
21:12:01.766372 IP 138.197.143.231.22 > 198.96.85.106.49776: Flags [P.], seq 375868:376232, ack 3205, win 483, options [nop,nop,TS val 407906507 ecr 2550186703], length 364
21:12:01.772616 IP 198.96.85.106.49776 > 138.197.143.231.22: Flags [.], ack 376232, win 13064, options [nop,nop,TS val 2550186807 ecr 407906507], length 0
21:12:01.870316 IP 138.197.143.231.22 > 198.96.85.106.49776: Flags [P.], seq 376232:376596, ack 3205, win 483, options [nop,nop,TS val 407906611 ecr 2550186807], length 364
21:12:01.876687 IP 198.96.85.106.49776 > 138.197.143.231.22: Flags [.], ack 376596, win 13064, options [nop,nop,TS val 2550186911 ecr 407906611], length 0
21:12:01.974406 IP 138.197.143.231.22 > 198.96.85.106.49776: Flags [P.], seq 376596:376808, ack 3205, win 483, options [nop,nop,TS val 407906715 ecr 2550186911], length 212
21:12:01.974494 IP 138.197.143.231.22 > 198.96.85.106.49776: Flags [P.], seq 376808:377004, ack 3205, win 483, options [nop,nop,TS val 407906715 ecr 2550186911], length 196
21:12:01.980726 IP 198.96.85.106.49776 > 138.197.143.231.22: Flags [.], ack 377004, win 13064, options [nop,nop,TS val 2550187015 ecr 407906715], length 0
^C
2013 packets captured
2018 packets received by filter
0 packets dropped by kernel
